Ano,Nome da IES,Sigla da IES,Categ. Administrativa,UF da IES,IGC (Contínuo),IGC (Faixa)
2017,UNIVERSIDADE FEDERAL DE MATO GROSSO,UFMT,Pública Federal,MT,3.1076911422074,4
2017,UNIVERSIDADE DE BRASÍLIA,UNB,Pública Federal,DF,3.96367096636498,5
2017,UNIVERSIDADE FEDERAL DE SERGIPE,UFS,Pública Federal,SE,3.17784954259007,4
2017,UNIVERSIDADE FEDERAL DO AMAZONAS,UFAM,Pública Federal,AM,2.93943387969904,3
2017,UNIVERSIDADE FEDERAL DO PIAUÍ,UFPI,Pública Federal,PI,2.86631925174877,3
2017,UNIVERSIDADE FEDERAL DE OURO PRETO,UFOP,Pública Federal,MG,3.38279541229282,4
2017,UNIVERSIDADE FEDERAL DE SÃO CARLOS,UFSCAR,Pública Federal,SP,4.04988370388067,5
2017,UNIVERSIDADE FEDERAL DE VIÇOSA,UFV,Pública Federal,MG,4.06422534828711,5
2017,UNIVERSIDADE ESTADUAL DE LONDRINA,UEL,Pública Estadual,PR,3.68745482260617,4
2017,PONTIFÍCIA UNIVERSIDADE CATÓLICA DO PARANÁ,PUCPR,Privada Sem Fins Lucrativos,PR,3.21625383545679,4
2017,UNIVERSIDADE CATÓLICA DE PERNAMBUCO,UNICAP,Privada Sem Fins Lucrativos,PE,2.82545237116527,3
2017,UNIVERSIDADE FEDERAL DO RIO GRANDE,FURG,Pública Federal,RS,3.46193117198607,4
2017,UNIVERSIDADE DE CAXIAS DO SUL,UCS,Privada Sem Fins Lucrativos,RS,2.90954489507266,3
2017,UNIVERSIDADE DO VALE DO RIO DOS SINOS,UNISINOS,Privada Sem Fins Lucrativos,RS,3.50885396256956,4
2017,UNIVERSIDADE CATÓLICA DE PETRÓPOLIS,UCP,Privada Sem Fins Lucrativos,RJ,2.68805526554619,3
2017,UNIVERSIDADE FEDERAL DE UBERLÂNDIA,UFU,Pública Federal,MG,3.69795249544489,4
2017,UNIVERSIDADE CATÓLICA DE PELOTAS,UCPEL,Privada Sem Fins Lucrativos,RS,2.79942844087177,3
2017,PONTIFÍCIA UNIVERSIDADE CATÓLICA DE CAMPINAS,PUC-CAMPINAS,Privada Sem Fins Lucrativos,SP,2.61946735892429,3
2017,UNIVERSIDADE DE PASSO FUNDO,UPF,Privada Sem Fins Lucrativos,RS,2.77733612202342,3
2017,PONTIFÍCIA UNIVERSIDADE CATÓLICA DO RIO GRANDE DO SUL,PUCRS,Privada Sem Fins Lucrativos,RS,3.57194336312543,4
2017,UNIVERSIDADE PRESBITERIANA MACKENZIE,MACKENZIE,Privada Sem Fins Lucrativos,SP,3.07220476282537,4
2017,UNIVERSIDADE FEEVALE,FEEVALE,Privada Sem Fins Lucrativos,RS,3.15381534333616,4
2017,UNIVERSIDADE ESTADUAL DE SANTA CRUZ,UESC,Pública Estadual,BA,3.39257857777499,4
2017,UNIVERSIDADE VALE DO RIO VERDE,UNINCOR,Privada Sem Fins Lucrativos,MG,2.68190524112147,3
2017,UNIVERSIDADE ESTADUAL DO CEARÁ,UECE,Pública Estadual,CE,2.92010440752264,3
2017,UNIVERSIDADE JOSÉ DO ROSÁRIO VELLANO,UNIFENAS,Privada Sem Fins Lucrativos,MG,2.96507301144532,4
2017,UNIVERSIDADE ESTADUAL DE CIÊNCIAS DA SAÚDE DE ALAGOAS - UNCISAL,UNCISAL,Pública Estadual,AL,2.29410908727922,3
2017,FACULDADE DE TECNOLOGIA DE SOROCABA,FATEC SO,Pública Estadual,SP,2.93640424377947,3
2017,FACULDADE DE TECNOLOGIA DE SÃO PAULO,FATEC-SP,Pública Estadual,SP,2.528259586,3
2017,FACULDADE DE TECNOLOGIA DE AMERICANA,FATEC-AM,Pública Estadual,SP,2.70756727144877,3
2017,FACULDADE DE TECNOLOGIA RUBENS LARA,FATEC-BS,Pública Estadual,SP,2.63794831566324,3
2017,FACULDADE DE TECNOLOGIA DE JAHU,FATEC-JAHU,Pública Estadual,SP,2.4806438897673,3
2017,UNIVERSIDADE DO ESTADO DA BAHIA,UNEB,Pública Estadual,BA,2.74074214474945,3
2017,FUNDAÇÃO UNIVERSIDADE DO ESTADO DE SANTA CATARINA,UDESC,Pública Estadual,SC,3.53891927674742,4
2017,UNIVERSIDADE ESTADUAL DE GOIÁS,UEG,Pública Estadual,GO,2.49614192970574,3
2017,UNIVERSIDADE ESTADUAL DE CAMPINAS,UNICAMP,Pública Estadual,SP,4.38905373747867,5
2017,UNIVERSIDADE ESTADUAL PAULISTA JÚLIO DE MESQUITA FILHO,UNESP,Pública Estadual,SP,4.0440114993599,5
2017,UNIVERSIDADE ESTADUAL DE MARINGÁ,UEM,Pública Estadual,PR,3.58329699005611,4
2017,FACULDADE DE DIREITO DE SÃO BERNARDO DO CAMPO,FDSBC,Pessoa Jurídica De Direito Público - Municipal,SP,2.576024428,3
2017,FACULDADE DE DIREITO DE FRANCA,FDF,Pessoa Jurídica De Direito Público - Municipal,SP,2.53291952,3
2017,CENTRO UNIVERSITÁRIO MUNICIPAL DE FRANCA,UNI-FACEF,Especial,SP,2.64746458114957,3
2017,ESCOLA DE ENGENHARIA DE PIRACICABA,EEP/FUMEP,Pública Municipal,SP,2.53688242280649,3
2017,FACULDADE DE FILOSOFIA CIÊNCIAS E LETRAS DE PENÁPOLIS,FAFIPE,Pública Municipal,SP,2.28801792443052,3
2017,UNIVERSIDADE DO ESTADO DO RIO GRANDE DO NORTE,UERN,Pública Estadual,RN,2.66765745780856,3
2017,CENTRO DE ENSINO SUPERIOR DE ARCOVERDE,CESA,Especial,PE,1.75304627204265,2
2017,FACULDADE DE FILOSOFIA CIÊNCIAS E LETRAS DE SÃO JOSÉ DO RIO PARDO,FFCL,Pública Municipal,SP,1.43501257762054,2
2017,UNIVERSIDADE REGIONAL DE BLUMENAU,FURB,Pública Municipal,SC,2.73707915662592,3
2017,FACULDADE DA REGIÃO DOS LAGOS,FERLAGOS,Privada Sem Fins Lucrativos,RJ,3.43607675548,4
2017,FACULDADE DE FILOSOFIA CIÊNCIAS E LETRAS DE ALEGRE,FAFIA,Pública Municipal,ES,1.92539115581625,2
2017,INSTITUTO MUNICIPAL DE ENSINO SUPERIOR DE CATANDUVA,IMES CATANDUVA,Pública Municipal,SP,2.65345782201279,3
2017,CENTRO UNIVERSITÁRIO PARA O DESENVOLVIMENTO DO ALTO VALE DO ITAJAÍ,UNIDAVI,Privada Sem Fins Lucrativos,SC,2.69009595269657,3
2017,UNIVERSIDADE DA REGIÃO DE JOINVILLE,UNIVILLE,Privada Sem Fins Lucrativos,SC,2.59379550602508,3
2017,UNIVERSIDADE DO OESTE DE SANTA CATARINA,UNOESC,Privada Sem Fins Lucrativos,SC,2.75613122970282,3
2017,UNIVERSIDADE DO VALE DO ITAJAÍ,UNIVALI,Privada Sem Fins Lucrativos,SC,2.97868407986126,4
2017,FACULDADE DE FILOSOFIA CIÊNCIAS E LETRAS DE MACAÉ,FAFIMA,Privada Sem Fins Lucrativos,RJ,2.46440662555556,3
2017,CENTRO UNIVERSITÁRIO DE BRUSQUE,UNIFEBE,Privada Sem Fins Lucrativos,SC,2.7071885227042,3
2017,FACULDADE DE MEDICINA DE JUNDIAÍ,FMJ,Pessoa Jurídica De Direito Público - Municipal,SP,3.50276090240283,4
2017,UNIVERSIDADE ESTADUAL DO VALE DO ACARAÚ,UVA,Pública Estadual,CE,2.30367667576407,3
2017,FACULDADE DE DIREITO DE CONSELHEIRO LAFAIETE,FDCL,Pessoa Jurídica De Direito Privado - Sem Fins Lucrativos,MG,1.971871114,3
2017,UNIVERSIDADE FEDERAL DE SÃO JOÃO DEL REI,UFSJ,Pública Federal,MG,3.38792222886843,4
2017,FACULDADES INTEGRADAS RUI BARBOSA,FIRB,Privada Com Fins Lucrativos,SP,2.47378214631416,3
2017,UNIVERSIDADE DE ARARAQUARA,UNIARA,Privada Sem Fins Lucrativos,SP,2.66067787611434,3
2017,CENTRO UNIVERSITÁRIO DE ARARAS -,UNAR,Privada Sem Fins Lucrativos,SP,2.51120213017993,3
2017,INSTITUTO NACIONAL DE TELECOMUNICAÇÕES,INATEL,Privada Sem Fins Lucrativos,MG,3.1146578356756,4
2017,FACULDADE DE EDUCAÇÃO FÍSICA DE BARRA BONITA,FAEFI,Privada Sem Fins Lucrativos,SP,1.88429266368493,2
2017,CENTRO UNIVERSITÁRIO CLARETIANO,CEUCLAR,Privada Sem Fins Lucrativos,SP,3.06862949342952,4
2017,UNIVERSIDADE DO SAGRADO CORAÇÃO,USC,Privada Sem Fins Lucrativos,SP,3.18861336945524,4
2017,CENTRO UNIVERSITÁRIO BARÃO DE MAUÁ,CBM,Privada Sem Fins Lucrativos,SP,2.75381386116958,3
2017,FACULDADE DE CIÊNCIAS ECONÔMICAS DO TRIÂNGULO MINEIRO,FCETM,Privada Sem Fins Lucrativos,MG,3.86883037125,4
2017,UNIVERSIDADE DE VASSOURAS,,Privada Sem Fins Lucrativos,RJ,2.76947718198946,3
2017,FACULDADE DE DIREITO DE VARGINHA - FADIVA,FADIVA,Privada Sem Fins Lucrativos,MG,2.238722832,3
2017,CENTRO UNIVERSITÁRIO DO TRIÂNGULO,UNITRI,Privada Sem Fins Lucrativos,MG,2.37864238131881,3
2017,UNIVERSIDADE DE UBERABA,UNIUBE,Privada Sem Fins Lucrativos,MG,2.35438182091687,3
2017,FACULDADE DE CIÊNCIAS HUMANAS DE OLINDA,FACHO,Privada Sem Fins Lucrativos,PE,2.45111496131055,3
2017,CENTRO UNIVERSITÁRIO DE RIO PRETO,UNIRP,Privada Com Fins Lucrativos,SP,2.59571399738759,3
2017,FACULDADE DE MEDICINA DE SÃO JOSÉ DO RIO PRETO,FAMERP,Pessoa Jurídica De Direito Público - Estadual,SP,3.79086296569775,4
2017,UNIVERSIDADE DE SOROCABA,UNISO,Privada Sem Fins Lucrativos,SP,2.59714525123009,3
2017,ESCOLA DE ADMINISTRAÇÃO DE EMPRESAS DE SÃO PAULO,FGV-EAESP,Privada Sem Fins Lucrativos,SP,4.25421419784209,5
2017,FACULDADE DE CIÊNCIAS CONTÁBEIS,FACIC,Privada Sem Fins Lucrativos,BA,2.46059719,3
2017,CONSERVATÓRIO BRASILEIRO DE MÚSICA - CENTRO UNIVERSITÁRIO,CBM/CEU,Privada Sem Fins Lucrativos,RJ,2.646872635,3
2017,FACULDADE DE FILOSOFIA CIÊNCIAS E LETRAS DE CARUARU,FAFICA,Privada Sem Fins Lucrativos,PE,2.42617274993538,3
2017,FACULDADE FRASSINETTI DO RECIFE,FAFIRE,Privada Sem Fins Lucrativos,PE,2.46899093243969,3
2017,CENTRO UNIVERSITÁRIO ASSUNÇÃO,UNIFAI,Privada Sem Fins Lucrativos,SP,2.44823116161098,3
2017,CENTRO UNIVERSITÁRIO BELAS ARTES DE SÃO PAULO,FEBASP,Privada Sem Fins Lucrativos,SP,2.52031845957178,3
2017,UNIVERSIDADE ESTÁCIO DE SÁ,UNESA,Privada Com Fins Lucrativos,RJ,3.03567988614189,4
2017,UNIVERSIDADE VEIGA DE ALMEIDA,UVA,Privada Com Fins Lucrativos,RJ,2.95225167087302,4
2017,"FAI - CENTRO DE ENSINO SUPERIOR EM GESTÃO, TECNOLOGIA E EDUCAÇÃO",,Privada Sem Fins Lucrativos,MG,2.88832524781454,3
2017,UNIVERSIDADE METODISTA DE SÃO PAULO,UMESP,Privada Sem Fins Lucrativos,SP,2.77745312926471,3
2017,FACULDADES DA FUNDAÇÃO DE ENSINO DE MOCOCA,FAFEM,Pública Municipal,SP,1.70119652458333,2
2017,FACULDADE DE DIREITO DO SUL DE MINAS,FDSM,Privada Sem Fins Lucrativos,MG,2.94516186963842,4
2017,UNIVERSIDADE CASTELO BRANCO,UCB,Privada Sem Fins Lucrativos,RJ,2.51318114682888,3
2017,ESCOLA DE MEDICINA SOUZA MARQUES DA FUNDAÇÃO TÉCNICO-EDUCACIONAL SOUZA MARQUES,EMSM,Privada Sem Fins Lucrativos,RJ,2.266215568,3
2017,FACULDADE DE CIÊNCIAS CONTÁBEIS E DE ADMINISTRAÇÃO DE EMPRESAS,FCCAE,Privada Sem Fins Lucrativos,RJ,2.05582398039344,3
2017,FACULDADE DE FILOSOFIA CIÊNCIAS E LETRAS SOUZA MARQUES,FFCLSM,Privada Sem Fins Lucrativos,RJ,2.01537240301799,3
2017,FACULDADE DE ENGENHARIA SOUZA MARQUES,FESM,Privada Sem Fins Lucrativos,RJ,2.53513594692245,3
2017,ESCOLA DE ENFERMAGEM DA FUNDAÇÃO TÉCNICO EDUCACIONAL SOUZA MARQUES,EEFTESM,Privada Sem Fins Lucrativos,RJ,4.076567947,5
2017,FACULDADE MORAES JÚNIOR - MACKENZIE RIO,FMJ - MACKENZIE RIO,Pessoa Jurídica De Direito Privado - Sem Fins Lucrativos,RJ,2.82082947172062,3
2017,FACULDADE DE EDUCAÇÃO SUPERIOR DO PARANÁ,FESPPR,Privada Sem Fins Lucrativos,PR,2.1639144543745,3
2017,FACULDADE CÁSPER LÍBERO,FCL,Privada Sem Fins Lucrativos,SP,2.74511429063295,3
2017,FACULDADE DO RIO DE JANEIRO,,Privada Com Fins Lucrativos,RJ,1.63303714871126,2
2017,UNIVERSIDADE SÃO JUDAS TADEU,USJT,Privada Com Fins Lucrativos,SP,3.24429109157596,4
2017,CENTRO UNIVERSITÁRIO ÍTALO-BRASILEIRO,UNIÍTALO,Privada Sem Fins Lucrativos,SP,2.67766081121087,3
2017,CENTRO UNIVERSITÁRIO MOURA LACERDA,CUML,Privada Sem Fins Lucrativos,SP,2.89998275639008,3
2017,UNIVERSIDADE DE RIBEIRÃO PRETO,UNAERP,Privada Sem Fins Lucrativos,SP,3.11681563376841,4
2017,CENTRO UNIVERSITÁRIO ÁLVARES PENTEADO,FECAP,Privada Sem Fins Lucrativos,SP,3.27741102196362,4
2017,FACULDADE DE ENGENHARIA DE MINAS GERAIS - FEAMIG,FEAMIG,Privada Sem Fins Lucrativos,MG,2.75211681340646,3
2017,CENTRO UNIVERSITÁRIO METODISTA IZABELA HENDRIX,CEUNIH,Privada Sem Fins Lucrativos,MG,2.47558510004061,3
2017,CENTRO UNIVERSITÁRIO DAS FACULDADES ASSOCIADAS DE ENSINO - FAE,UNIFAE,Especial,SP,2.75998085372338,3
2017,FACULDADE DE EDUCAÇÃO CIÊNCIAS E ARTES DOM BOSCO DE MONTE APRAZÍVEL,FAECA DOM BOSCO,Privada Sem Fins Lucrativos,SP,2.05830728933753,3
2017,FACULDADE SÃO JUDAS TADEU,FSJT,Privada Sem Fins Lucrativos,RJ,2.30534239564311,3
2017,UNIVERSIDADE CRUZEIRO DO SUL,UNICSUL,Privada Com Fins Lucrativos,SP,3.00415909480956,4
2017,CENTRO UNIVERSITÁRIO DE VOTUPORANGA,UNIFEV,Privada Sem Fins Lucrativos,SP,2.74526738608651,3
2017,FACULDADE DE MEDICINA DO ABC,FMABC,Privada Sem Fins Lucrativos,SP,3.47384127111951,4
2017,FACULDADE DE SANTO ANDRÉ,,Privada Sem Fins Lucrativos,SP,2.14643927325214,3
2017,CENTRO UNIVERSITÁRIO LUSÍADA,UNILUS,Pessoa Jurídica De Direito Privado - Sem Fins Lucrativos,SP,2.59884825786204,3
2017,UNIVERSIDADE CATÓLICA DE SANTOS,UNISANTOS,Privada Sem Fins Lucrativos,SP,3.06616755029671,4
2017,FACULDADE DE SÃO BERNARDO DO CAMPO - FASB,FASB I,Privada Sem Fins Lucrativos,SP,2.68323441737638,3
2017,FACULDADES OSWALDO CRUZ,FOC,Privada Com Fins Lucrativos,SP,2.60429673145027,3
2017,UNIVERSIDADE SANTA ÚRSULA,USU,Privada Sem Fins Lucrativos,RJ,2.327608694325,3
2017,CENTRO UNIVERSITÁRIO ANHANGUERA DE SANTO ANDRÉ,UNIA,Privada Com Fins Lucrativos,SP,2.03802749424104,3
2017,FACULDADE DO CLUBE NÁUTICO MOGIANO,FCNM,Privada Sem Fins Lucrativos,SP,2.62851214888915,3
2017,CENTRO UNIVERSITÁRIO FIEO,UNIFIEO,Privada Sem Fins Lucrativos,SP,2.40648926027293,3
2017,CENTRO UNIVERSITÁRIO DE SÃO PAULO - UNI SÃO PAULO,,Privada Com Fins Lucrativos,SP,2.17861674202046,3
2017,FACULDADE DE ENGENHARIA E AGRIMENSURA DE PIRASSUNUNGA - FEAP,FEAP,Privada Sem Fins Lucrativos,SP,1.220730535,2
2017,FACULDADES INTEGRADAS CAMPOS SALLES,FICS,Privada Sem Fins Lucrativos,SP,2.49469871942575,3
2017,FACULDADES INTEGRADAS DE OURINHOS,FIO,Privada Sem Fins Lucrativos,SP,3.38488278496534,4
2017,UNIVERSIDADE METODISTA DE PIRACICABA,UNIMEP,Privada Sem Fins Lucrativos,SP,2.73473167151644,3
2017,CENTRO UNIVERSITÁRIO ESPÍRITO-SANTENSE/FAESA,,Privada Sem Fins Lucrativos,ES,3.68797976856958,4
2017,FACULDADE DE DIREITO DA ALTA PAULISTA,FADAP,Privada Com Fins Lucrativos,SP,2.122687378,3
2017,FACULDADE FACCAT,FACCAT,Privada Com Fins Lucrativos,SP,2.07720476338754,3
2017,FACULDADE DE TUPÃ,,Privada Com Fins Lucrativos,SP,2.49819151926166,3
2017,UNIVERSIDADE DO OESTE PAULISTA,UNOESTE,Privada Sem Fins Lucrativos,SP,3.35126629453933,4
2017,UNIVERSIDADE DO VALE DO PARAÍBA,UNIVAP,Privada Sem Fins Lucrativos,SP,2.70836185010615,3
2017,FACULDADE DE DIREITO DE SOROCABA,FADI,Privada Sem Fins Lucrativos,SP,2.56369438,3
2017,CENTRO UNIVERSITÁRIO AUGUSTO MOTTA,UNISUAM,Privada Sem Fins Lucrativos,RJ,2.4848933076823,3
2017,FACULDADES INTEGRADAS SIMONSEN,FIS,Privada Sem Fins Lucrativos,RJ,2.49243420203171,3
2017,FACULDADES INTEGRADAS HÉLIO ALONSO,FACHA,Privada Sem Fins Lucrativos,RJ,2.30916025890447,3
2017,FACULDADE DE MEDICINA DE ITAJUBÁ,FMIT,Privada Sem Fins Lucrativos,MG,2.241160754,3
2017,FACULDADE DE DIREITO DO VALE DO RIO DOCE,FADIVALE,Privada Sem Fins Lucrativos,MG,1.889500909,2
2017,FACULDADE TRÊS DE MAIO,SETREM,Privada Sem Fins Lucrativos,RS,2.80274875717927,3
2017,UNIVERSIDADE DE SANTA CRUZ DO SUL,UNISC,Privada Sem Fins Lucrativos,RS,3.05550448458663,4
2017,UNIVERSIDADE DA REGIÃO DA CAMPANHA,URCAMP,Privada Sem Fins Lucrativos,RS,2.25058118093578,3
2017,UNIVERSIDADE PITÁGORAS UNOPAR,,Privada Com Fins Lucrativos,PR,2.53398763415045,3
2017,FACULDADE DE JANDAIA DO SUL,FAFIJAN,Privada Sem Fins Lucrativos,PR,2.42486894687828,3
2017,"FACULDADE DE CIÊNCIAS ECONÔMICAS, ADMINISTRATIVAS E CONTÁBEIS DE DIVINÓPOLIS",FACED,Privada Com Fins Lucrativos,MG,2.81184458071375,3
2017,FACULDADE DE MEDICINA DE BARBACENA,FAME,Pessoa Jurídica De Direito Privado - Sem Fins Lucrativos,MG,2.567106545,3
2017,UNIVERSIDADE PRESIDENTE ANTÔNIO CARLOS,UNIPAC,Privada Sem Fins Lucrativos,MG,2.07135916480684,3
2017,UNIVERSIDADE NOVE DE JULHO,UNINOVE,Privada Sem Fins Lucrativos,SP,3.14678624757135,4
2017,UNIVERSIDADE BRASIL,,Privada Sem Fins Lucrativos,SP,2.63669982020725,3
2017,UNIVERSIDADE PAULISTA,UNIP,Privada Com Fins Lucrativos,SP,2.76865224279866,3
2017,UNIVERSIDADE IGUAÇU,UNIG,Privada Sem Fins Lucrativos,RJ,2.18193976268649,3
2017,FACULDADE MACHADO SOBRINHO,FMS,Privada Sem Fins Lucrativos,MG,2.70259142684615,3
2017,CENTRO DE ENSINO SUPERIOR DE JUIZ DE FORA,CES/JF,Privada Sem Fins Lucrativos,MG,2.2211746424011,3
2017,PONTIFÍCIA UNIVERSIDADE CATÓLICA DE MINAS GERAIS,PUC MINAS,Privada Sem Fins Lucrativos,MG,3.03512455952989,4
2017,FACULDADE SANTA EMÍLIA DE RODAT,FASER,Privada Sem Fins Lucrativos,PB,1.61211565546474,2
2017,CENTRO UNIVERSITÁRIO NEWTON PAIVA,NEWTON PAIVA,Privada Com Fins Lucrativos,MG,2.67433866247482,3
2017,CENTRO UNIVERSITÁRIO UNA,UNA,Privada Com Fins Lucrativos,MG,3.13262742452107,4
2017,ESCOLA DE ENGENHARIA KENNEDY,EEK,Privada Sem Fins Lucrativos,MG,2.298660636,3
2017,INSTITUTO SUPERIOR DE CIÊNCIAS APLICADAS - ISCA,ISCA,Privada Sem Fins Lucrativos,SP,2.26993141687627,3
2017,CENTRO UNIVERSITÁRIO DE BELO HORIZONTE,UNI-BH,Privada Com Fins Lucrativos,MG,3.10998252503508,4
2017,FACULDADE DE CIÊNCIAS MÉDICAS DE MINAS GERAIS,FCMMG,Privada Sem Fins Lucrativos,MG,2.51298371358462,3
2017,CENTRO UNIVERSITÁRIO DE JOÃO PESSOA,UNIPÊ,Privada Com Fins Lucrativos,PB,2.74513055238774,3
2017,FACULDADE EVANGÉLICA DO PARANÁ,FEPAR,Privada Sem Fins Lucrativos,PR,2.95315378482276,4
2017,UNIVERSIDADE TUIUTI DO PARANÁ,UTP,Privada Com Fins Lucrativos,PR,3.22990893836396,4
2017,CENTRO UNIVERSITÁRIO PAULISTANO,UNIPAULISTANA,Privada Sem Fins Lucrativos,SP,2.30462597840933,3
2017,FACULDADE PAULISTA DE SERVIÇO SOCIAL DE SÃO CAETANO DO SUL,FAPSS-SCS,Privada Sem Fins Lucrativos,SP,3.63085533,4
2017,FACULDADE PAULISTA DE SERVIÇO SOCIAL,FAPSS-SP.,Privada Sem Fins Lucrativos,SP,2.700945322,3
2017,FACULDADE MOZARTEUM DE SÃO PAULO,FAMOSP,Privada Sem Fins Lucrativos,SP,2.247220659,3
2017,UNIVERSIDADE ESTADUAL DE MONTES CLAROS,UNIMONTES,Pública Estadual,MG,2.84735032780096,3
2017,FACULDADE DE EDUCAÇÃO FÍSICA DA ASSOCIAÇÃO CRISTÃ DE MOÇOS DE SOROCABA,FEFISO,Privada Sem Fins Lucrativos,SP,2.72136968492069,3
2017,FACULDADE PAULISTA DE ARTES,FPA,Privada Sem Fins Lucrativos,SP,2.28093084756757,3
2017,FACULDADE DE MÚSICA CARLOS GOMES,FMCG,Privada Com Fins Lucrativos,SP,1.828857672,2
2017,ESCOLA DE SOCIOLOGIA E POLÍTICA DE SÃO PAULO,ESP,Privada Sem Fins Lucrativos,SP,3.133702328,4
2017,CENTRO UNIVERSITÁRIO DAS FACULDADES METROPOLITANAS UNIDAS,FMU,Privada Sem Fins Lucrativos,SP,2.75271092963667,3
2017,UNIVERSIDADE SANTO AMARO,UNISA,Privada Sem Fins Lucrativos,SP,2.4643891399424,3
2017,CENTRO UNIVERSITÁRIO ANHANGUERA DE SÃO PAULO,,Privada Com Fins Lucrativos,SP,2.20386875921259,3
2017,UNIVERSIDADE DA AMAZÔNIA,UNAMA,Privada Com Fins Lucrativos,PA,2.59814638607725,3
2017,CENTRO UNIVERSITÁRIO DE ANÁPOLIS,UNIEVANGÉLICA,Privada Sem Fins Lucrativos,GO,2.86368466410376,3
2017,UNIVERSIDADE SALVADOR,UNIFACS,Privada Com Fins Lucrativos,BA,3.05035239203399,4
2017,CENTRO UNIVERSITÁRIO DE GOIÁS,UNI-ANHANGÜERA,Privada Com Fins Lucrativos,GO,2.42862244969039,3
2017,UNIVERSIDADE CATÓLICA DOM BOSCO,UCDB,Privada Sem Fins Lucrativos,MS,2.90006168759004,3
2017,FACULDADE RUY BARBOSA WYDEN,FRB WYDEN,Privada Com Fins Lucrativos,BA,2.83219487304374,3
2017,UNIVERSIDADE TIRADENTES,UNIT,Privada Com Fins Lucrativos,SE,3.02335143181991,4
2017,CENTRO UNIVERSITÁRIO DE BRASÍLIA,UNICEUB,Privada Sem Fins Lucrativos,DF,2.67150969407553,3
2017,UNIVERSIDADE CATÓLICA DE BRASÍLIA,UCB,Privada Sem Fins Lucrativos,DF,2.97083377086224,4
2017,FACULDADES INTEGRADAS DA UPIS,UPIS,Privada Sem Fins Lucrativos,DF,2.01109138562648,3
2017,FOCCA - FACULDADE DE OLINDA,FOCCA,Privada Sem Fins Lucrativos,PE,2.99971837478836,4
2017,UNIVERSIDADE DE PERNAMBUCO,UPE,Pública Estadual,PE,2.79766431181907,3
2017,FACULDADE DE CIÊNCIAS HUMANAS ESUDA,FCHE,Privada Sem Fins Lucrativos,PE,2.8196854482813,3
2017,FACULDADE DE CIÊNCIAS MÉDICAS DA SANTA CASA SÃO PAULO,FCMSCSP,Privada Sem Fins Lucrativos,SP,3.86385928770532,4
2017,FACULDADE DE SÃO PAULO,FASP,Privada Com Fins Lucrativos,SP,1.86456801451329,2
2017,UNIVERSIDADE CIDADE DE SÃO PAULO,UNICID,Privada Com Fins Lucrativos,SP,2.97213103116654,4
2017,UNIVERSIDADE DE MARÍLIA,UNIMAR,Privada Com Fins Lucrativos,SP,2.99499810409131,4
2017,UNIVERSIDADE REGIONAL INTEGRADA DO ALTO URUGUAI E DAS MISSÕES,URI,Privada Sem Fins Lucrativos,RS,2.70694614021721,3
2017,UNIVERSIDADE FRANCISCANA,UNIFRA,Privada Sem Fins Lucrativos,RS,3.01221873475397,4
2017,CENTRO UNIVERSITÁRIO FILADÉLFIA,UNIFIL,Privada Sem Fins Lucrativos,PR,3.17524871401617,4
2017,FACULDADE DE MEDICINA DE MARÍLIA,FAMEMA,Pessoa Jurídica De Direito Público - Estadual,SP,3.02273341865966,4
2017,FACULDADE PARANAENSE,FACCAR,Privada Sem Fins Lucrativos,PR,2.40925832289736,3
2017,FACULDADE SANTA MARCELINA,FASM,Privada Sem Fins Lucrativos,SP,2.27379323822826,3
2017,FACULDADE SANTA MARCELINA MURIAÉ - FASM,FASM,Privada Sem Fins Lucrativos,MG,2.07593186529278,3
2017,UNIVERSIDADE PARANAENSE,UNIPAR,Privada Sem Fins Lucrativos,PR,2.54992539160361,3
2017,FACULDADE DE FILOSOFIA CIÊNCIAS E LETRAS DE ITUVERAVA,FFCL,Privada Sem Fins Lucrativos,SP,2.59836496139182,3
2017,FACULDADE DOUTOR FRANCISCO MAEDA,FAFRAM,Privada Sem Fins Lucrativos,SP,2.64367899392247,3
2017,FACULDADE DE DIREITO DE ITÚ,FADITU,Privada Com Fins Lucrativos,SP,2.147976317,3
2017,UNIVERSIDADE DO CONTESTADO,UNC,Privada Sem Fins Lucrativos,SC,2.6118444290757,3
2017,UNIVERSIDADE DE CRUZ ALTA,UNICRUZ,Privada Sem Fins Lucrativos,RS,2.85824513346278,3
2017,CENTRO UNIVERSITÁRIO RITTER DOS REIS,UNIRITTER,Privada Com Fins Lucrativos,RS,3.04119804294523,4
2017,UNIVERSIDADE LUTERANA DO BRASIL,ULBRA,Privada Sem Fins Lucrativos,RS,2.72634562381537,3
2017,CENTRO UNIVERSITÁRIO LUTERANO DE JI-PARANÁ,CEULJI/ULBRA,Privada Sem Fins Lucrativos,RO,2.5134325150215,3
2017,CENTRO UNIVERSITÁRIO LUTERANO DE SANTARÉM,CEULS,Privada Sem Fins Lucrativos,PA,2.27200285221827,3
2017,CENTRO UNIVERSITÁRIO LUTERANO DE MANAUS,CEULM/ULBRA,Privada Sem Fins Lucrativos,AM,2.07401900228326,3
2017,CENTRO UNIVERSITÁRIO LUTERANO DE PALMAS,CEULP,Privada Sem Fins Lucrativos,TO,2.88958455598273,3
2017,FACULDADE CAMAQÜENSE DE CIÊNCIAS CONTÁBEIS E ADMINISTRATIVAS,FACCCA,Privada Sem Fins Lucrativos,RS,2.27992210678947,3
2017,CENTRO UNIVERSITÁRIO SANT´ANNA,UNISANT'ANNA,Privada Sem Fins Lucrativos,SP,2.15791407756852,3
2017,UNIVERSIDADE ANHANGUERA DE SÃO PAULO,UNIAN - SP,Privada Com Fins Lucrativos,SP,2.28206671434322,3
2017,UNIVERSIDADE IBIRAPUERA,UNIB,Privada Sem Fins Lucrativos,SP,2.57416623943187,3
2017,FACULDADE DE ARTES PLÁSTICAS DA FUNDAÇÃO ARMANDO ALVARES PENTEADO,FAAP,Privada Sem Fins Lucrativos,SP,2.41192094670975,3
2017,FACULDADE DE ADMINISTRAÇÃO DA FUNDAÇÃO ARMANDO ALVARES PENTEADO,FAE-FAAP,Privada Sem Fins Lucrativos,SP,2.444888356,3
2017,FACULDADE DE ENGENHARIA DA FUNDAÇÃO ARMANDO ALVARES PENTEADO,FEFAAP,Privada Sem Fins Lucrativos,SP,2.21781415448929,3
2017,FACULDADE DE COMUNICAÇÃO E MARKETING DA - FUNDAÇÃO ARMANDO ÁLVARES PENTEADO,FACOM-FAAP,Privada Sem Fins Lucrativos,SP,2.354728711,3
2017,FACULDADE DE ECONOMIA DA FUNDAÇÃO ARMANDO ALVARES PENTEADO,FEC-FAAP,Privada Sem Fins Lucrativos,SP,2.22544794848684,3
2017,UNIVERSIDADE ANHEMBI MORUMBI,UAM,Privada Com Fins Lucrativos,SP,3.11344681941428,4
2017,FACULDADE DE CIÊNCIAS CONTÁBEIS DE ITAPETININGA,FCCI,Privada Com Fins Lucrativos,SP,1.09489653577083,2
2017,UNIVERSIDADE DO GRANDE RIO PROFESSOR JOSÉ DE SOUZA HERDY,UNIGRANRIO,Privada Com Fins Lucrativos,RJ,2.84434070600651,3
2017,"FACULDADE DE CIÊNCIAS ECONÔMICAS, ADMINISTRATIVAS E DA COMPUTAÇÃO DOM BOSCO",FCEACDB,Privada Sem Fins Lucrativos,RJ,2.41051466580903,3
2017,FACULDADE DE FILOSOFIA CIÊNCIAS E LETRAS DOM BOSCO,FFCLDB,Privada Sem Fins Lucrativos,RJ,2.27392569135366,3
2017,FACULDADE DE MEDICINA DE PETRÓPOLIS,FMP,Privada Sem Fins Lucrativos,RJ,2.495544928,3
2017,CENTRO UNIVERSITÁRIO SERRA DOS ÓRGÃOS,UNIFESO,Privada Sem Fins Lucrativos,RJ,2.37827352243405,3
2017,Universidade Universus Veritas Guarulhos,Univeritas UNG,Privada Sem Fins Lucrativos,SP,2.37976450137458,3
2017,UNIVERSIDADE DO EXTREMO SUL CATARINENSE,UNESC,Privada Sem Fins Lucrativos,SC,2.80591249387222,3
2017,CENTRO UNIVERSITÁRIO METROPOLITANO DE SÃO PAULO,UNIMESP,Privada Sem Fins Lucrativos,SP,2.31194588371938,3
2017,CENTRO UNIVERSITÁRIO DE VOLTA REDONDA,UNIFOA,Privada Sem Fins Lucrativos,RJ,3.10359002175839,4
2017,CENTRO DE ENSINO SUPERIOR DE VALENÇA,CESVA,Privada Sem Fins Lucrativos,RJ,3.62685749007813,4
2017,FACULDADE DE EDUCAÇÃO CIÊNCIAS E LETRAS DON DOMÊNICO,FECLE,Privada Sem Fins Lucrativos,SP,2.75196013558788,3
2017,FACULDADE DE ADMINISTRAÇÃO CIÊNCIAS ECON E CONTÁBEIS DE GUARATINGUETÁ,FACEAG,Privada Sem Fins Lucrativos,SP,2.10186338498113,3
2017,FACULDADE DE EDUCAÇÃO DE GUARATINGUETÁ,FACEG,Privada Sem Fins Lucrativos,SP,1.774718255,2
2017,UNIVERSIDADE DO SUL DE SANTA CATARINA,UNISUL,Privada Sem Fins Lucrativos,SC,2.75389655201993,3
2017,FACULDADE DE CIÊNCIAS E LETRAS DE BRAGANÇA PAULISTA,FESB,Pública Municipal,SP,2.09902120656736,3
2017,UNIVERSIDADE DE FRANCA,UNIFRAN,Privada Com Fins Lucrativos,SP,2.86565737775724,3
2017,ESCOLA SUPERIOR DE CIÊNCIAS DA SANTA CASA DE MISERICÓRDIA DE VITÓRIA,EMESCAM,Privada Sem Fins Lucrativos,ES,3.15888421497674,4
2017,CENTRO UNIVERSITÁRIO SÃO JUDAS TADEU,CSJT,Privada Com Fins Lucrativos,SP,3.03251120460091,4
2017,FACULDADE DE MEDICINA DE CAMPOS,FMC,Privada Sem Fins Lucrativos,RJ,2.35384254708253,3
2017,FACULDADE TRIÂNGULO MINEIRO,FTM,Privada Sem Fins Lucrativos,MG,2.07934911024194,3
2017,FACULDADE DE CIÊNCIAS SOCIAIS APLICADAS DO SUL DE MINAS - FACESM,FACESM,Privada Sem Fins Lucrativos,MG,1.86762156119174,2
2017,ESCOLA DE ENFERMAGEM WENCESLAU BRAZ,EEWB,Privada Sem Fins Lucrativos,MG,2.813049864,3
2017,UNIVERSIDADE VALE DO RIO DOCE,UNIVALE,Privada Sem Fins Lucrativos,MG,2.07668888884327,3
2017,CENTRO UNIVERSITÁRIO DE BARRA MANSA,UBM,Privada Sem Fins Lucrativos,RJ,2.299409745384,3
2017,CENTRO UNIVERSITÁRIO ANHANGUERA DE NITERÓI,UNIAN-RJ,Privada Com Fins Lucrativos,RJ,2.22410430791159,3
2017,CENTRO UNIVERSITÁRIO DO RIO DE JANEIRO,UNIRJ,Privada Sem Fins Lucrativos,RJ,1.87903809801832,2
2017,FACULDADE DE EDUCAÇÃO SÃO LUÍS,FESL,Privada Sem Fins Lucrativos,SP,2.7843436805163,3
2017,CENTRO UNIVERSITÁRIO DO DISTRITO FEDERAL,UDF,Privada Com Fins Lucrativos,DF,2.85084560424524,3
2017,UNIVERSIDADE CATÓLICA DO SALVADOR,UCSAL,Privada Sem Fins Lucrativos,BA,2.38013483348136,3
2017,UNIVERSIDADE DE MOGI DAS CRUZES,UMC,Privada Com Fins Lucrativos,SP,2.67203506523374,3
2017,CENTRO UNIVERSITÁRIO CELSO LISBOA,UCL,Privada Sem Fins Lucrativos,RJ,2.47164517950223,3
2017,CENTRO UNIVERSITÁRIO BRAZ CUBAS,,Privada Com Fins Lucrativos,SP,2.63927924634622,3
2017,PONTIFÍCIA UNIVERSIDADE CATÓLICA DE GOIÁS,PUC GOIÁS,Privada Sem Fins Lucrativos,GO,2.58242386226009,3
2017,PONTIFÍCIA UNIVERSIDADE CATÓLICA DO RIO DE JANEIRO,PUC-RIO,Privada Sem Fins Lucrativos,RJ,3.81056291027625,4
2017,FACULDADE DE MÚSICA DO ESPÍRITO SANTO,FAMES,Pública Estadual,ES,1.74427537,2
2017,UNIVERSIDADE REGIONAL DO NOROESTE DO ESTADO DO RIO GRANDE DO SUL,UNIJUI,Privada Sem Fins Lucrativos,RS,3.06443186630368,4
