Ano,Nome da IES,Sigla da IES,Categ. Administrativa,UF da IES,IGC (Contínuo),IGC (Faixa)
2017,"FACULDADE DE TECNOLOGIA EM HOTELARIA, GASTRONOMIA E TURISMO DE SÃO PAULO",HOTEC,Privada Com Fins Lucrativos,SP,2.0593486296041,3
2017,FACULDADE DE TECNOLOGIA DE ALAGOAS,FAT/AL,Privada Sem Fins Lucrativos,AL,2.36496003677627,3
2017,FACULDADE DO VALE DO ITAPECURÚ,FAI,Privada Com Fins Lucrativos,MA,2.30549629710248,3
2017,FACULDADE DO ESPÍRITO SANTO,UNES,Privada Com Fins Lucrativos,ES,3.79298906193993,4
2017,Faculdade de São Caetano do Sul,,Privada Com Fins Lucrativos,SP,2.13710658885507,3
2017,INSTITUTO SUPERIOR DE EDUCAÇÃO ORÍGENES LESSA,ISEOL,Privada Sem Fins Lucrativos,SP,1.961226156,3
2017,CENTRO DE ESTUDOS SUPERIORES APRENDIZ,CESA,Privada Com Fins Lucrativos,MG,1.929283674,2
2017,FACULDADE METROPOLITANA DA GRANDE FORTALEZA,FAMETRO,Privada Com Fins Lucrativos,CE,3.1520019312933,4
2017,FACULDADE SINERGIA,SINERGIA,Privada Com Fins Lucrativos,SC,3.03383560011268,4
2017,FACULDADE DE CIÊNCIAS GERENCIAIS DE MANHUAÇU,FACIG,Privada Com Fins Lucrativos,MG,2.60890979505505,3
2017,CENTRO UNIVERSITÁRIO ESTÁCIO JUIZ DE FORA - ESTÁCIO JUIZ DE FORA,,Privada Com Fins Lucrativos,MG,2.98721291200719,4
2017,FACULDADE AVANTIS,AVANTIS,Privada Com Fins Lucrativos,SC,3.20297771209473,4
2017,INSTITUTO DE ENSINO SUPERIOR DE PIEDADE,IESP,Privada Sem Fins Lucrativos,PE,2.665665435,3
2017,FACULDADE DE MEDICINA NOVA ESPERANÇA,FAMENE,Privada Com Fins Lucrativos,PB,2.904210944,3
2017,INSTITUTO CUIABÁ DE ENSINO E CULTURA,ICEC,Privada Com Fins Lucrativos,MT,1.87573805991639,2
2017,INSTITUTO SUPERIOR DE EDUCAÇÃO ELVIRA DAYRELL,ISEED,Privada Com Fins Lucrativos,MG,1.41410848382979,2
2017,SEMINÁRIO ADVENTISTA LATINO-AMERICANO DE TEOLOGIA,SALT,Privada Sem Fins Lucrativos,BA,2.191243048,3
2017,FACULDADE DE CIÊNCIAS SOCIAIS APLICADAS DE SINOP,FACISAS,Privada Com Fins Lucrativos,MT,2.85612674941452,3
2017,FACULDADE DE TAQUARITINGA,FTGA,Privada Com Fins Lucrativos,SP,2.16588993679665,3
2017,FACULDADE ESAMC SOROCABA,ESAMC,Privada Com Fins Lucrativos,SP,2.53396462822605,3
2017,INSTITUTO SUPERIOR DE EDUCAÇÃO DE PESQUEIRA,ISEP,Privada Com Fins Lucrativos,PE,1.70696696218502,2
2017,INSTITUTO SANTO TOMÁS DE AQUINO,ISTA,Privada Sem Fins Lucrativos,MG,2.89406363315508,3
2017,FACULDADE JK - UNIDADE II - GAMA,,Privada Com Fins Lucrativos,DF,1.89966966593619,2
2017,FACULDADE DE ROLIM DE MOURA,FAROL,Privada Com Fins Lucrativos,RO,2.30967859991201,3
2017,Centro Universitário FG,UNIFG,Privada Com Fins Lucrativos,BA,2.65782225288168,3
2017,FACULDADE DE CAMPINA GRANDE,FAC-CG,Privada Com Fins Lucrativos,PB,2.33575860014192,3
2017,INSTITUTO SUPERIOR DE EDUCAÇÃO CAMPO LIMPO PAULISTA,ISECAMP,Privada Com Fins Lucrativos,SP,2.48612391236101,3
2017,INSTITUTO SUPERIOR DE EDUCAÇÃO DE FLORESTA,ISEF,Privada Com Fins Lucrativos,PE,1.395027978,2
2017,UNIÃO LATINO-AMERICANA DE TECNOLOGIA,ULT,Privada Com Fins Lucrativos,PR,2.56044554663256,3
2017,Faculdade Estácio do Pará - Estácio FAP,ESTÁCIO FAP,Privada Com Fins Lucrativos,PA,3.2060861505496,4
2017,FACULDADE UNIME DE CIÊNCIAS EXATAS E TECNOLÓGICAS,FCT,Privada Com Fins Lucrativos,BA,3.15071510051884,4
2017,FACULDADE CIDADE LUZ,FACILUZ,Privada Com Fins Lucrativos,SP,1.957709817,3
2017,FACULDADE DO FUTURO,FAF,Privada Com Fins Lucrativos,MG,2.51449320591892,3
2017,FACULDADE SUDAMÉRICA,SUDAMÉRICA,Privada Sem Fins Lucrativos,MG,2.67469832652594,3
2017,FACULDADE FIGUEIREDO COSTA - FIC,,Privada Com Fins Lucrativos,AL,2.74181063284767,3
2017,FACULDADE VALE DO SALGADO,FVS,Privada Com Fins Lucrativos,CE,3.30307034368477,4
2017,FACULDADE AMADEUS,FAMA,Privada Com Fins Lucrativos,SE,2.81980975040137,3
2017,INSTITUTO DE ESTUDOS SUPERIORES DO MARANHÃO,IESMA,Privada Sem Fins Lucrativos,MA,2.13574914125253,3
2017,FACULDADE DA ALTA PAULISTA,FAP,Privada Com Fins Lucrativos,SP,2.46826849172361,3
2017,FACULDADE METROPOLITANA,UNNESA,Privada Com Fins Lucrativos,RO,2.78014752750943,3
2017,FACULDADE DE CIÊNCIAS E EMPREENDEDORISMO,FACEMP,Privada Com Fins Lucrativos,BA,2.46191384794619,3
2017,FACULDADE DE TEOLOGIA E CIÊNCIAS HUMANAS,FATECH,Privada Sem Fins Lucrativos,AP,2.069476998,3
2017,FACULDADE DE DESENVOLVIMENTO SUSTENTÁVEL DE CRUZEIRO DO SUL,IEVAL,Privada Sem Fins Lucrativos,AC,2.45277927032,3
2017,INSTITUTO DE ENSINO SUPERIOR DE ALAGOAS,IESA,Privada Sem Fins Lucrativos,AL,1.87129604343293,2
2017,Centro Universitário Regional do Brasil,,Privada Com Fins Lucrativos,BA,2.45665720560358,3
2017,FACULDADE DE ITAITUBA,FAI,Privada Com Fins Lucrativos,PA,2.285481105264,3
2017,FACULDADE DE CIÊNCIAS MÉDICAS DA PARAÍBA,FCM-PB,Privada Com Fins Lucrativos,PB,3.00910457546279,4
2017,FACULDADE CENECISTA DE NOVA PETRÓPOLIS,FACENP,Privada Sem Fins Lucrativos,RS,1.93082079243284,2
2017,INSTITUTO BAIANO DE ENSINO SUPERIOR,IBES,Privada Sem Fins Lucrativos,BA,2.25727475802478,3
2017,INSTITUTO DE ENSINO SUPERIOR DE FOZ DO IGUAÇU,IESFI,Privada Com Fins Lucrativos,PR,2.61905688618543,3
2017,Faculdade Doctum de Manhuaçu,DOCTUM,Privada Sem Fins Lucrativos,MG,3.112732983,4
2017,FACULDADE EXCELÊNCIA,FAEX,Privada Sem Fins Lucrativos,CE,1.70116392984928,2
2017,FACULDADE DE AURIFLAMA,FAU,Privada Com Fins Lucrativos,SP,2.28774627506299,3
2017,CENTRO UNIVERSITÁRIO INTA,UNINTA,Privada Sem Fins Lucrativos,CE,2.8195855887002,3
2017,FACULDADE DOM BOSCO DE PORTO ALEGRE,FDB,Privada Sem Fins Lucrativos,RS,3.02860242808829,4
2017,FACULDADE DE CIÊNCIA E TECNOLOGIA,FACITEC,Privada Com Fins Lucrativos,PR,2.00522261780501,3
2017,Estácio FASE - Faculdade Estácio de Sergipe,Estácio FASE,Privada Com Fins Lucrativos,SE,2.6545634507143,3
2017,FACULDADE MAX PLANCK,FMP,Privada Com Fins Lucrativos,SP,2.4889066815801,3
2017,FACULDADE CALAFIORI,CALAFIORI,Privada Com Fins Lucrativos,MG,2.65634135835669,3
2017,ESCOLA DE DIREITO DO RIO DE JANEIRO,DIREITO RIO,Privada Sem Fins Lucrativos,RJ,3.89006590124516,4
2017,Escola de Direito de São Paulo - FGV DIREITO SP,FGV DIREITO SP,Privada Sem Fins Lucrativos,SP,4.20867987147321,5
2017,ESCOLA DE ECONOMIA DE SÃO PAULO,EESP,Privada Sem Fins Lucrativos,SP,4.80901580460043,5
2017,FACULDADE FAPAN,FAPAN,Privada Com Fins Lucrativos,SP,2.036854424,3
2017,FACULDADE BARÃO DO RIO BRANCO,FAB,Privada Com Fins Lucrativos,AC,2.69977614589724,3
2017,"Faculdade de Ciências, Educação e Teologia do Norte do Brasil",FACETEN,Privada Sem Fins Lucrativos,RR,2.87452027397207,3
2017,FACULDADE DA IGREJA MINISTÉRIO FAMA,FAIFA,Privada Sem Fins Lucrativos,GO,1.647298256,2
2017,CENTRO UNIVERSITÁRIO CATÓLICA DE QUIXADÁ,,Privada Sem Fins Lucrativos,CE,2.78305261669629,3
2017,INSTITUTO SUPERIOR DE EDUCAÇÃO NOSSA SENHORA DE LOURDES,FNSL,Privada Com Fins Lucrativos,BA,1.292177196,2
2017,FACULDADES BATISTA DO PARANÁ,FABAPAR,Privada Sem Fins Lucrativos,PR,3.1080394644973,4
2017,FACULDADE PROMOVE DE TECNOLOGIA,FPTEC,Privada Com Fins Lucrativos,MG,3.14290840321813,4
2017,FACULDADE DO ACRE,FAC,Privada Com Fins Lucrativos,AC,2.69624358216522,3
2017,Centro Universitário CEUNI - FAMETRO,FAMETRO,Privada Com Fins Lucrativos,AM,2.93957682059365,3
2017,FACULDADE DE PALMAS,FAPAL,Privada Com Fins Lucrativos,TO,2.401425431892,3
2017,FACULDADE MATO GROSSO DO SUL,FACSUL,Privada Com Fins Lucrativos,MS,2.2599495734366,3
2017,FACULDADE DO PIAUÍ,FAPI,Privada Com Fins Lucrativos,PI,2.17811741047789,3
2017,INSTITUTO SUPERIOR DE CIÊNCIAS HUMANAS E SOCIAIS ANÍSIO TEIXEIRA,ISAT,Privada Com Fins Lucrativos,RJ,2.55949463095973,3
2017,FACULDADE SÃO TOMÁS DE AQUINO,FACESTA,Privada Sem Fins Lucrativos,AL,1.37866601526667,2
2017,INSTITUTO SUPERIOR DE EDUCAÇÃO SANT´ANA,ISESA,Privada Sem Fins Lucrativos,PR,2.57173839518687,3
2017,FACULDADE SANTA MARIA,FSM,Privada Com Fins Lucrativos,PB,2.41817480216067,3
2017,FACULDADE SANT'ANA,IESSA,Privada Sem Fins Lucrativos,PR,2.46399108691573,3
2017,FACULDADE EUGÊNIO GOMES,FEG,Privada Sem Fins Lucrativos,BA,3.393293777,4
2017,FACULDADE FOZ DO IGUAÇU,FAFIG,Privada Sem Fins Lucrativos,PR,1.89721471,2
2017,FACULDADE CAMPO GRANDE,FCG,Privada Com Fins Lucrativos,MS,1.93577742868415,2
2017,INSTITUTO BELO HORIZONTE DE ENSINO SUPERIOR,IBHES,Privada Sem Fins Lucrativos,MG,2.1490886365788,3
2017,FACULDADE GUAIANÁS,FAG,Privada Com Fins Lucrativos,SP,1.59432156931387,2
2017,FACULDADE DE SANTA CATARINA,FASC,Privada Sem Fins Lucrativos,SC,2.29559997028327,3
2017,FACULDADE METROPOLITANA DE BLUMENAU,FAMEBLU,Privada Com Fins Lucrativos,SC,2.71077396972495,3
2017,INSTITUTO PAULISTA DE ENSINO,FIPEN,Privada Com Fins Lucrativos,SP,2.28981252415686,3
2017,RATIO - FACULDADE TEOLÓGICA E FILOSÓFICA,RATIO,Privada Com Fins Lucrativos,CE,2.372395831,3
2017,CENTRO UNIVERSITÁRIO FUNDAÇÃO SANTO ANDRÉ,CUFSA,Privada Sem Fins Lucrativos,SP,2.16796906510931,3
2017,FACULDADE CNEC GRAVATAÍ,,Privada Sem Fins Lucrativos,RS,2.45654310405303,3
2017,FACULDADE SALESIANA DOM BOSCO,FSDB,Privada Sem Fins Lucrativos,AM,2.0763135965634,3
2017,FACULDADE DO MARANHÃO,FACAM-MA,Privada Com Fins Lucrativos,MA,2.30872245424269,3
2017,FACULDADE ANHANGUERA DE PELOTAS,,Privada Com Fins Lucrativos,RS,2.14163816222954,3
2017,INSTITUTO SUPERIOR DE EDUCAÇÃO IVOTI,ISEI,Privada Sem Fins Lucrativos,RS,3.02122918122794,4
2017,FACULDADE ANHANGUERA DO RIO GRANDE,,Privada Com Fins Lucrativos,RS,2.03828590196699,3
2017,Faculdade Villas Boas,FVB,Privada Com Fins Lucrativos,SP,1.59666307460388,2
2017,FACULDADE MONTEIRO LOBATO,FATO,Privada Sem Fins Lucrativos,RS,1.95094018114085,3
2017,FACULDADE VALE DO GORUTUBA,FAVAG,Privada Com Fins Lucrativos,MG,1.88439450892921,2
2017,INSTITUTO SUPERIOR DE EDUCAÇÃO DE GUARATUBA,ISEPE Guaratuba,Privada Com Fins Lucrativos,PR,3.555337836,4
2017,FACULDADE DE TUPI PAULISTA,-,Privada Sem Fins Lucrativos,SP,2.86485059012195,3
2017,FACULDADE FAE SÃO JOSÉ DOS PINHAIS,,Privada Sem Fins Lucrativos,PR,3.09686922542424,4
2017,Faculdade Doctum de Juiz de Fora,DOCTUM,Privada Sem Fins Lucrativos,MG,2.83293559143823,3
2017,FACULDADE SETE DE SETEMBRO,FASETE,Privada Com Fins Lucrativos,BA,2.53102240887232,3
2017,FACULDADE VICTOR HUGO,FVH,Privada Com Fins Lucrativos,MG,2.31233340152265,3
2017,FACULDADE DE CIÊNCIAS SOCIAIS APLICADAS DE BELO HORIZONTE,FACISABH,Privada Com Fins Lucrativos,MG,2.15811551014258,3
2017,FACULDADE TEOLÓGICA BATISTA EQUATORIAL,FATEBE,Privada Sem Fins Lucrativos,PA,1.856498904,2
2017,FACULDADE DE FORTALEZA,FAFOR,Privada Com Fins Lucrativos,CE,2.28983221254152,3
2017,FACULDADE DO SUDESTE MINEIRO,FACSUM,Privada Com Fins Lucrativos,MG,2.66464503101023,3
2017,FACULDADE DO RECIFE,FAREC,Privada Sem Fins Lucrativos,PE,2.30423829511642,3
2017,FACULDADE PARAÍBANA,FAP,Privada Sem Fins Lucrativos,PB,1.27422887849112,2
2017,FACULDADE DA CIDADE DE MACEIÓ,FACIMA,Privada Com Fins Lucrativos,AL,1.92109448577076,2
2017,FACULDADE DO ESPÍRITO SANTO,FACES,Privada Sem Fins Lucrativos,ES,3.158681731,4
2017,Faculdade Paulista São José,,Privada Sem Fins Lucrativos,SP,1.54373887668872,2
2017,FACULDADE SERGIPANA,FASER,Privada Sem Fins Lucrativos,SE,1.58618576219079,2
2017,FACULDADE DIADEMA,FAD,Privada Sem Fins Lucrativos,SP,1.83174165195471,2
2017,FACULDADE DE COMUNICAÇÃO PITÁGORAS UNIDADE GUARAPARI,PIT GUARAPARI,Privada Com Fins Lucrativos,ES,3.434842944,4
2017,FACULDADE CAMBURY DE FORMOSA,CAMBURY,Pessoa Jurídica De Direito Privado - Com Fins Lucrativos,GO,2.221222704,3
2017,FACULDADE DE CIÊNCIAS SOCIAIS APLICADAS DE EXTREMA,FAEX,Privada Sem Fins Lucrativos,MG,2.83412270356613,3
2017,FACULDADE PITÁGORAS DE IPATINGA,FPI,Privada Com Fins Lucrativos,MG,2.7489042207849,3
2017,FACULDADE DE DIREITO SANTO AGOSTINHO,FADISA,Privada Com Fins Lucrativos,MG,2.248585864,3
2017,Centro Universitário Metrocamp Wyden,UNIMETROCAMP WYDEN,Privada Com Fins Lucrativos,SP,2.79179709916495,3
2017,FACULDADE DE CAFELÂNDIA,FAC,Privada Com Fins Lucrativos,PR,1.856402168,2
2017,ESCOLA SUPERIOR DE TEOLOGIA E ESPIRITUALIDADE FRANCISCANA,ESTEF,Privada Sem Fins Lucrativos,RS,2.6407231,3
2017,FACULDADE ALMEIDA RODRIGUES,FAR,Privada Com Fins Lucrativos,GO,2.75947232362082,3
2017,FACULDADE UNIÃO CULTURAL DO ESTADO DE SÃO PAULO,UCESP,Privada Sem Fins Lucrativos,SP,1.295954188,2
2017,FACULDADE DE DIREITO DE SANTA MARIA,FADISMA,Privada Com Fins Lucrativos,RS,2.113793809,3
2017,FACULDADE FIDELIS,FF,Privada Sem Fins Lucrativos,PR,2.584910951,3
2017,FACULDADE KENNEDY DE MINAS GERAIS - FKMG,FKMG,Privada Sem Fins Lucrativos,MG,2.948858498,4
2017,FACULDADE LUTERANA RUI BARBOSA,FALURB,Privada Sem Fins Lucrativos,PR,2.31561529671375,3
2017,ESCOLA SUPERIOR DE EDUCAÇÃO CORPORATIVA,ESEC,Privada Com Fins Lucrativos,SC,2.728127184,3
2017,INSTITUTO SUPERIOR DE EDUCAÇÃO ATENEU,ISEAT,Privada Com Fins Lucrativos,ES,2.314741425,3
2017,FACULDADE DA AMAZÔNIA,FAMA,Privada Com Fins Lucrativos,RO,0.876425976636076,1
2017,FACULDADE UNIÃO BANDEIRANTE,,Privada Com Fins Lucrativos,SC,2.02461796990963,3
2017,FACULDADE ITEANA DE BOTUCATU,FITB,Privada Sem Fins Lucrativos,SP,2.38124862838596,3
2017,Faculdade Cândido Rondon,FCR,Privada Com Fins Lucrativos,MT,1.823526518,2
2017,FACULDADE CORPORATIVA CESPI,FACESPI,Privada Com Fins Lucrativos,SP,1.90997536942857,2
2017,FACULDADE CNEC RIO DAS OSTRAS,,Privada Sem Fins Lucrativos,RJ,2.63351866726685,3
2017,FACULDADE MONTES BELOS,FMB,Privada Com Fins Lucrativos,GO,2.78526075800458,3
2017,FACULDADE DA ALDEIA DE CARAPICUÍBA,FALC,Privada Com Fins Lucrativos,SP,2.55627007940685,3
2017,FACULDADE DA AMAZÔNIA OCIDENTAL,FAAO,Privada Com Fins Lucrativos,AC,2.70292789455705,3
2017,INSTITUTO SUPERIOR DE FILOSOFIA BERTHIER,IFIBE,Privada Sem Fins Lucrativos,RS,2.974588581,4
2017,INSTITUIÇÃO DE ENSINO SÃO FRANCISCO,IESF,Privada Com Fins Lucrativos,SP,2.35910600206048,3
2017,ESCOLA SUPERIOR MADRE CELESTE,ESMAC,Privada Com Fins Lucrativos,PA,2.55466118951263,3
2017,FACULDADE ESPÍRITO SANTENSE DE CIÊNCIAS JURÍDICAS,PIO XII - DIR,Privada Sem Fins Lucrativos,ES,2.205896111,3
2017,FACULDADE ANHANGUERA DE MATÃO,,Privada Com Fins Lucrativos,SP,2.00656491554237,3
2017,FACULDADE PAN AMERICANA,FPA,Privada Sem Fins Lucrativos,PA,1.832259373,2
2017,FACULDADE PADRÃO,,Privada Com Fins Lucrativos,GO,2.815971723,3
2017,FACULDADE DE CIÊNCIAS MÉDICAS DE CAMPINA GRANDE,FCM,Privada Com Fins Lucrativos,PB,2.41059668141543,3
2017,FACULDADE DE ADMINISTRAÇÃO DE EMPRESAS DE PARAÍSO DO TOCANTINS,FAP,Privada Com Fins Lucrativos,TO,1.239482013,2
2017,FACULDADE CATÓLICA DO TOCANTINS,FACTO,Privada Sem Fins Lucrativos,TO,2.5400896451208,3
2017,FACULDADE SÃO LEOPOLDO MANDIC,,Privada Com Fins Lucrativos,SP,4.47315131999387,5
2017,INSTITUTO DE ENSINO SUPERIOR SANTO ANTÔNIO,INESA,Privada Com Fins Lucrativos,SC,2.36283037907955,3
2017,Faculdade Estácio do Amapá - Estácio Amapá,ESTÁCIO AMAPÁ,Privada Com Fins Lucrativos,AP,2.75879465592745,3
2017,FACULDADE MERIDIONAL,IMED,Privada Com Fins Lucrativos,RS,3.1267038900353,4
2017,FACULDADE INTEGRADA DO BRASIL,FAIBRA,Privada Sem Fins Lucrativos,PI,1.43629711703099,2
2017,FACULDADE DE FILOSOFIA E TEOLOGIA PAULO VI,FFTP,Privada Sem Fins Lucrativos,SP,2.70106426264583,3
2017,FACULDADE FUCAPE,FUCAPE,Privada Sem Fins Lucrativos,ES,4.3462817426748,5
2017,FACULDADE DE SOROCABA,,Privada Com Fins Lucrativos,SP,2.23916825944324,3
2017,Faculdade de Tecnologia e Ciências,FTC CENTRO,Privada Com Fins Lucrativos,BA,2.64628499293276,3
2017,FACULDADE ESAMC SANTOS,ESAMC,Privada Com Fins Lucrativos,SP,1.91996272477021,2
2017,CENTRO UNIVERSITÁRIO TABOSA DE ALMEIDA,ASCES-UNITA,Privada Sem Fins Lucrativos,PE,2.62800440048599,3
2017,FACULDADE CEARENSE,FAC,Privada Sem Fins Lucrativos,CE,2.12761572294451,3
2017,FACULDADE DE ENSINO SUPERIOR DE FLORIANO,FAESF,Privada Com Fins Lucrativos,PI,2.43716493281456,3
2017,FACULDADE PARANAENSE,FAPAR,Privada Com Fins Lucrativos,PR,2.19018505918919,3
2017,FACULDADE DE CIÊNCIA E TECNOLOGIA DE MONTES CLAROS,FACIT,Privada Sem Fins Lucrativos,MG,2.62638009978309,3
2017,FACULDADE INTEGRADA BRASIL AMAZONIA - FIBRA,FIBRA,Privada Com Fins Lucrativos,PA,2.94742168644215,4
2017,FACULDADE DE CIÊNCIAS GERENCIAIS DA BAHIA,UNICENID,Privada Com Fins Lucrativos,BA,1.42226358549708,2
2017,FACULDADE DE CIÊNCIAS E TECNOLOGIAS DE CAMPOS GERAIS,FACICA,Privada Com Fins Lucrativos,MG,2.54645895857324,3
2017,Faculdade Estácio de Ibiúna,ESTÁCIO IBIÚNA,Privada Com Fins Lucrativos,SP,1.97895755170823,3
2017,FACULDADE PITÁGORAS DE TEIXEIRA DE FREITAS,PIT TEIXEIRA,Privada Com Fins Lucrativos,BA,2.46638819205518,3
2017,FACULDADE CIDADE DE JOÃO PINHEIRO,FCJP,Privada Sem Fins Lucrativos,MG,2.73485996835211,3
2017,FACULDADE DE CIÊNCIAS BIOMÉDICAS DO ESPÍRITO SANTO,PIO XII - BIO,Privada Sem Fins Lucrativos,ES,2.691066934,3
2017,FACULDADE FUNORTE DE JANAÚBA,,Privada Com Fins Lucrativos,MG,3.046082986,4
2017,INSTITUTO EDUCACIONAL DE CASTRO,INEC,Privada Com Fins Lucrativos,PR,NA,SC
2017,FACULDADE PROMOVE DE BELO HORIZONTE,PROMOVE,Privada Sem Fins Lucrativos,MG,2.96407679300923,4
2017,FACULDADES INTEGRADAS IPIRANGA,FAINTIPI,Privada Sem Fins Lucrativos,PA,1.76965704144444,2
2017,FACULDADE DE ADMINISTRAÇÃO DE CHAPADÃO DO SUL,FACHASUL,Privada Sem Fins Lucrativos,MS,2.07063528677686,3
2017,FACULDADE DE ESTUDOS AVANÇADOS DO PARÁ,FEAPA,Privada Com Fins Lucrativos,PA,2.56102319560714,3
2017,FACULDADE ESTÁCIO DE NATAL,ESTÁCIO DE NATAL,Privada Com Fins Lucrativos,RN,2.58608852396086,3
2017,FACULDADE SÃO LUÍS,FSL,Privada Sem Fins Lucrativos,SC,2.697867339,3
2017,FACULDADE DAMÁSIO,FD,Privada Com Fins Lucrativos,SP,3.300754436,4
2017,INSTITUTO TEOLÓGICO FRANCISCANO,ITF,Privada Sem Fins Lucrativos,RJ,3.458686657,4
2017,INSTITUTO MACAPAENSE DE ENSINO SUPERIOR,IMMES,Privada Com Fins Lucrativos,AP,1.53579532586166,2
2017,INSTITUTO SALVADOR DE ENSINO E CULTURA,ISEC,Privada Sem Fins Lucrativos,BA,1.97368797027131,3
2017,FACULDADE MARIA MILZA,FAMAM,Privada Com Fins Lucrativos,BA,3.13113489477472,4
2017,FACULDADE DOM LUCIANO MENDES,FDLM,Privada Sem Fins Lucrativos,MG,2.912228854,3
2017,FACULDADE DE ADMINISTRAÇÃO DE MARIANA,FAMA,Privada Sem Fins Lucrativos,MG,1.84227407836493,2
2017,FACULDADE DE INTEGRAÇÃO DO ENSINO SUPERIOR DO CONE SUL,FISUL,Privada Com Fins Lucrativos,RS,2.22334994173183,3
2017,FACULDADE PROCESSUS,PFD,Privada Sem Fins Lucrativos,DF,2.20806939244037,3
2017,FACULDADE CATÓLICA DE FORTALEZA,FCF,Privada Sem Fins Lucrativos,CE,2.67957123861321,3
2017,FACULDADE ANGLICANA DE ERECHIM,FAE,Privada Sem Fins Lucrativos,RS,2.0466822979867,3
2017,INSTITUTO SUPERIOR DE EDUCAÇÃO DO CECAP,ISCECAP,Privada Sem Fins Lucrativos,DF,1.879955695,2
2017,FUNVIC - FACULDADE DE PINDAMONHANGABA,,Privada Sem Fins Lucrativos,SP,2.66183598646801,3
2017,FACULDADE ATENEU,FATE,Privada Com Fins Lucrativos,CE,3.3741180936006,4
2017,FASS - FACULDADE SOCIAL SUL AMERICANA,,Privada Com Fins Lucrativos,BA,1.74360807015945,2
2017,FACULDADE ESTÁCIO DE SÁ DE GOIÁS,FESGO,Privada Com Fins Lucrativos,GO,2.64059367818454,3
2017,FACULDADE DE DIREITO UNIDADE GUARAPARI,FADIG,Privada Com Fins Lucrativos,ES,2.496355989,3
2017,FACULDADE ARTHUR THOMAS,CESA,Privada Com Fins Lucrativos,PR,2.93014230548569,3
2017,INSTITUTO SUPERIOR DE EDUCAÇÃO DO SUL DO PIAUÍ,ISESPI,Privada Com Fins Lucrativos,PI,1.827179498,2
2017,FACULDADE DE CIÊNCIAS DE GUARULHOS,FACIG,Privada Com Fins Lucrativos,SP,2.29399756045298,3
2017,FACULDADE DO SUDESTE GOIANO,FASUG,Privada Com Fins Lucrativos,GO,2.51490849618182,3
2017,FACULDADE RORAIMENSE DE ENSINO SUPERIOR,FARES,Privada Com Fins Lucrativos,RR,1.73385496977466,2
2017,FACULDADE SÃO GERALDO,FSG,Privada Com Fins Lucrativos,ES,3.43085115612795,4
2017,FACULDADE VENDA NOVA DO IMIGRANTE,FAVENI,Privada Com Fins Lucrativos,ES,3.01010735102273,4
2017,FACULDADE EVANGÉLICA DO MEIO NORTE,FAEME,Privada Sem Fins Lucrativos,MA,2.016676977,3
2017,"FACULDADE DE TEOLOGIA, FILOSOFIA E CIÊNCIAS HUMANAS GAMALIEL",FATEFIG,Privada Com Fins Lucrativos,PA,2.23877240046117,3
2017,FACULDADE DE EDUCAÇÃO SANTA TEREZINHA,FEST,Privada Com Fins Lucrativos,MA,2.00914400611929,3
2017,FIAM-FAAM - CENTRO UNIVERSITÁRIO,UNIFIAM-FAAM,Privada Sem Fins Lucrativos,SP,2.516973489184,3
2017,FACULDADE DE ENSINO SUPERIOR DA CIDADE DE FEIRA DE SANTANA,FAESF/UNEF,Pessoa Jurídica De Direito Privado - Com Fins Lucrativos,BA,3.29492411881884,4
2017,UNIVERSIDADE FEDERAL DE CAMPINA GRANDE,UFCG,Pública Federal,PB,3.26785202444787,4
2017,ABEU - CENTRO UNIVERSITÁRIO,UNIABEU,Privada Sem Fins Lucrativos,RJ,2.25614803132167,3
2017,INSTITUTO DE ENSINO SUPERIOR DE OLINDA,IESO,Privada Sem Fins Lucrativos,PE,2.16447813642155,3
2017,FACULDADE ZACARIAS DE GÓES,FAZAG,Privada Sem Fins Lucrativos,BA,2.0985719609005,3
2017,FACULDADE DE TECNOLOGIA FAESA,CET-FAESA,Privada Sem Fins Lucrativos,ES,2.36283326466593,3
2017,CENTRO UNIVERSITÁRIO REDENTOR,FACREDENTOR,Privada Sem Fins Lucrativos,RJ,3.24280525777317,4
2017,"FACULDADE REGIONAL DE FILOSOFIA, CIÊNCIAS E LETRAS DE CANDEIAS",FAC,Privada Com Fins Lucrativos,BA,1.67118126274521,2
2017,FACULDADE TEOLÓGICA SUL AMERICANA,FTSA,Privada Sem Fins Lucrativos,PR,2.86858027668852,3
2017,FACULDADES PITÁGORAS UNIDADE GUARAPARI,FIPAG,Privada Com Fins Lucrativos,ES,2.2969879048668,3
2017,FACULDADE ATENAS,,Privada Com Fins Lucrativos,MG,3.65653024533124,4
2017,FACULDADE SÃO SALVADOR,FSS,Privada Com Fins Lucrativos,BA,2.32598309927325,3
2017,FACULDADE DE ENSINO SUPERIOR DO CENTRO DO PARANÁ,UCP,Privada Sem Fins Lucrativos,PR,2.85613621949194,3
2017,ESCOLA BRASILEIRA DE ECONOMIA E FINANÇAS,EBEF,Privada Sem Fins Lucrativos,RJ,4.88378590680086,5
2017,FACULDADE DE JUAZEIRO DO NORTE,FJN,Privada Com Fins Lucrativos,CE,2.58722041629927,3
2017,FACULDADE TEOLÓGICA BATISTA ANA WOLLERMAN,FTBAW,Privada Sem Fins Lucrativos,MS,1.897663428,2
2017,Faculdade Meta,FAMETA,Privada Com Fins Lucrativos,AC,3.114823984834,4
2017,FACULDADE SANTO ANTÔNIO DE PÁDUA,FASAP,Privada Com Fins Lucrativos,RJ,2.48647494821097,3
2017,FACULDADE SÃO BENTO DO RIO DE JANEIRO,FSB/RJ,Privada Sem Fins Lucrativos,RJ,2.64894179610135,3
2017,FACULDADE DE AMPÉRE,FAMPER,Privada Com Fins Lucrativos,PR,1.89137928602711,2
2017,FACULDADE DO TAPAJÓS,FAT,Privada Sem Fins Lucrativos,PA,1.89326698690654,2
2017,FACULDADE DO LITORAL PARANAENSE,FLP,Privada Com Fins Lucrativos,PR,1.75403990941623,2
2017,FACULDADE DE TECNOLOGIA IBTA - SÃO JOSÉ DOS CAMPOS,IBTA,Privada Com Fins Lucrativos,SP,2.15145745475952,3
2017,FACULDADE DE CIÊNCIAS CONTÁBEIS E DE ADMINISTRAÇÃO DO VALE DO JURUENA,AJES,Privada Sem Fins Lucrativos,MT,3.48986783213073,4
2017,INSTITUTO SUPERIOR DE EDUCAÇÃO DO VALE DO JURUENA,AJES,Privada Sem Fins Lucrativos,MT,3.511355049,4
2017,FACULDADES INTEGRADAS DO EXTREMO SUL DA BAHIA,UNESULBAHIA,Privada Sem Fins Lucrativos,BA,2.04157514216418,3
2017,FACULDADE DINÂMICA DO VALE DO PIRANGA,FADIP,Privada Com Fins Lucrativos,MG,2.71142472711207,3
2017,FACULDADE SÃO VICENTE,FASVIPA,Privada Sem Fins Lucrativos,AL,1.72605796308901,2
2017,FACULDADE INTEGRADA DE SANTA MARIA,FISMA,Privada Com Fins Lucrativos,RS,2.14481382296751,3
2017,FACULDADE UNIDA DE VITÓRIA,FACULDADE UNIDA,Privada Com Fins Lucrativos,ES,3.19318968390845,4
2017,FACULDADE DE RECIFE,,Privada Sem Fins Lucrativos,PE,2.36584220355211,3
2017,FACULDADE LA SALLE,,Privada Sem Fins Lucrativos,AM,2.37756982495765,3
2017,INSTITUTO SUPERIOR DE EDUCAÇÃO SÃO JUDAS TADEU,ISESJT,Privada Com Fins Lucrativos,PI,1.749329399,2
2017,FACULDADE DOM ALBERTO,FDA,Privada Com Fins Lucrativos,RS,2.63086478780072,3
2017,FACULDADE INESP - INSTITUTO NACIONAL DE ENSINO E PESQUISA,INESP,Privada Com Fins Lucrativos,SP,2.684676969,3
2017,FACULDADE DE CIÊNCIAS JURÍDICAS DE PARAÍSO DO TOCANTINS,FCJP,Privada Com Fins Lucrativos,TO,1.865925848,2
2017,FACULDADE SENAC MINAS,FSM,Privada Sem Fins Lucrativos,MG,3.00171757307521,4
2017,FACULDADE CATÓLICA RECIFE,FCR,Privada Sem Fins Lucrativos,PE,2.45822600825714,3
2017,INSTITUTO DE ENSINO SUPERIOR DO SUL DO MARANHÃO,IESMA,Privada Com Fins Lucrativos,MA,2.34821823499133,3
2017,ESCOLA SUPERIOR DE ADMINISTRAÇÃO DE EMPRESAS,INEA,Pessoa Jurídica De Direito Privado - Com Fins Lucrativos,SP,1.45440858147962,2
2017,FACULDADE CATÓLICA DOM ORIONE,FACDO,Privada Sem Fins Lucrativos,TO,2.20026617378977,3
2017,INSTITUTO SUPERIOR DE EDUCAÇÃO VERA CRUZ,ISE VERA CRUZ,Privada Sem Fins Lucrativos,SP,3.044582218,4
2017,ESCOLA SUPERIOR DA AMAZÔNIA,ESAMAZ,Privada Com Fins Lucrativos,PA,2.34516957120199,3
2017,Faculdade de Ciências Educacionais de Capim Grosso,FCG,Privada Com Fins Lucrativos,BA,2.3061843219588,3
2017,FACULDADE SÃO PAULO,FSP,Pessoa Jurídica De Direito Privado - Com Fins Lucrativos,RO,3.01608430544434,4
2017,FACULDADE DO VALE DO ITAJAÍ MIRIM,FAVIM,Privada Com Fins Lucrativos,SC,2.27696463551431,3
2017,FACULDADE ANHANGUERA DE VALPARAÍSO,,Privada Com Fins Lucrativos,GO,2.01206451655894,3
2017,FACULDADE DO SERTÃO,UESSBA,Privada Com Fins Lucrativos,BA,1.68331186985609,2
2017,FACULDADE DE CIÊNCIAS GERENCIAIS DE SÃO GOTARDO,CESG,Privada Com Fins Lucrativos,MG,3.61899965972789,4
2017,FACULDADE EMPRESARIAL DE CHAPECÓ,FAEM,Privada Com Fins Lucrativos,SC,2.50489811326016,3
2017,FACULDADE UNIDA DE CAMPINAS,FACUNICAMPS,Pessoa Jurídica De Direito Privado - Com Fins Lucrativos,GO,3.53300472157214,4
2017,CENTRO DE ENSINO SUPERIOR DE ILHÉUS,CESUPI,Privada Com Fins Lucrativos,BA,2.37110782778348,3
2017,FACULDADE DE MACAPÁ,,Privada Com Fins Lucrativos,AP,2.57936574489892,3
2017,Centro Universitário UNIFAFIBE,FAFIBE,Privada Sem Fins Lucrativos,SP,3.03295056069282,4
2017,Faculdades Integradas Desembargador Sávio Brandão,FAUSB,Privada Com Fins Lucrativos,MT,1.65056406756818,2
2017,FACULDADE DE INFORMÁTICA DE OURO PRETO DO OESTE,FIOURO,Privada Sem Fins Lucrativos,RO,2.22958114734906,3
2017,FACULDADE DE TECNOLOGIA DO NORDESTE,FATENE,Privada Com Fins Lucrativos,CE,2.48462801893161,3
2017,FACULDADE FAE BLUMENAU,,Privada Sem Fins Lucrativos,SC,2.857457222,3
2017,FACULDADES PEQUENO PRÍNCIPE,FPP,Privada Sem Fins Lucrativos,PR,3.0063808347751,4
2017,FACULDADE DE CIÊNCIAS AGRÁRIAS E EXATAS DE PRIMAVERA DO LESTE,,Privada Com Fins Lucrativos,MT,2.44821806707782,3
2017,FACULDADE UBS,FACULDADE UBS,Pessoa Jurídica De Direito Privado - Com Fins Lucrativos,SP,2.358014123,3
