Ano,Nome da IES,Sigla da IES,Categ. Administrativa,UF da IES,IGC (Contínuo),IGC (Faixa)
2017,FACULDADE DE CIÊNCIAS SOCIAIS E HUMANAS SOBRAL PINTO,FAIESP,Privada Com Fins Lucrativos,MT,2.42900219820798,3
2017,FACULDADE DE IPORÁ,FAI,Privada Com Fins Lucrativos,GO,2.85056070183432,3
2017,FANEESP - FACULDADE NACIONAL DE EDUCAÇÃO E ENSINO SUPERIOR DO PARANÁ,FANEESP,Privada Com Fins Lucrativos,PR,2.50352775752469,3
2017,FACULDADE MODELO,FACIMOD,Privada Com Fins Lucrativos,PR,2.43613099717391,3
2017,FACULDADES ITECNE DE CASCAVEL,ITECNE,Privada Com Fins Lucrativos,PR,1.800120686,2
2017,FACULDADE PAULUS DE TECNOLOGIA E COMUNICAÇÃO,FAPCOM,Privada Sem Fins Lucrativos,SP,3.25380627205814,4
2017,FACULDADE SÃO SEBASTIÃO,,Privada Com Fins Lucrativos,SP,2.85198283161122,3
2017,Faculdade Meridional RS,,Privada Com Fins Lucrativos,RS,2.991681512,4
2017,FACULDADE NOSSA SENHORA DE FÁTIMA,FACULDADE FÁTIMA,Privada Sem Fins Lucrativos,RS,2.40005969970419,3
2017,FACULDADE EVANGÉLICA DO PIAUI,FAEPI,Privada Sem Fins Lucrativos,PI,2.827620773,3
2017,FACULDADE DOM BOSCO DE GOIOERÊ,DOM BOSCO GOIOERÊ,Privada Sem Fins Lucrativos,PR,1.685535878,2
2017,Faculdade Superior de Ensino Programus,ISEPRO,Privada Com Fins Lucrativos,PI,2.130379541,3
2017,CENTRO UNIVERSITÁRIO MAURÍCIO DE NASSAU,UNINASSAU,Privada Com Fins Lucrativos,PE,2.64849787461878,3
2017,FACULDADE SUL DA AMÉRICA,SULDAMÉRICA,Privada Com Fins Lucrativos,GO,2.04041348,3
2017,FACULDADE PARANAPANEMA,FP,Privada Com Fins Lucrativos,PR,1.926057476,2
2017,FACULDADE DE CIÊNCIAS MÉDICAS E DA SAÚDE DE JUIZ DE FORA,FCMS/JF,Privada Com Fins Lucrativos,MG,3.24808209771947,4
2017,FACULDADE SALESIANA DOM BOSCO DE PIRACICABA,FSDB,Privada Sem Fins Lucrativos,SP,2.14058841414535,3
2017,FACULDADE REINALDO RAMOS,FARR,Privada Com Fins Lucrativos,PB,2.25129033430113,3
2017,FACULDADE DE TEOLOGIA UMBANDISTA,F.T.U.,Privada Sem Fins Lucrativos,SP,2.536827449,3
2017,ESCOLA SUPERIOR DOM HELDER CÂMARA,ESDHC,Privada Sem Fins Lucrativos,MG,3.05091954410291,4
2017,FACULDADE SÃO FRANCISCO DE ASSIS,UNIFIN,Privada Com Fins Lucrativos,RS,2.23215209277317,3
2017,FACULDADE DE BELÉM,FABEL,Privada Com Fins Lucrativos,PA,2.08949990922007,3
2017,FACULDADE SERRA DO CARMO,FASEC,Privada Com Fins Lucrativos,TO,2.3779695689019,3
2017,FACULDADE DE CAIEIRAS,,Privada Sem Fins Lucrativos,SP,1.94272432346472,2
2017,FACULDADE ZUMBI DOS PALMARES,FAZP,Privada Sem Fins Lucrativos,SP,1.63489323574272,2
2017,FACULDADE BARÃO DE PIRATININGA,AES,Privada Com Fins Lucrativos,SP,2.58217182591304,3
2017,FACULDADE SATC,FASATC,Privada Sem Fins Lucrativos,SC,2.93377352071657,3
2017,FACULDADE CONCÓRDIA,FACC,Privada Com Fins Lucrativos,SC,2.30319837789708,3
2017,FACULDADE JK - GUARÁ,ESAMC BRASÍLIA,Privada Com Fins Lucrativos,DF,2.51467690989218,3
2017,FACULDADE NATALENSE DE ENSINO E CULTURA,FANEC,Privada Com Fins Lucrativos,RN,1.82855165299385,2
2017,FACULDADE DO ESTADO DO MARANHÃO,FACEM,Privada Sem Fins Lucrativos,MA,1.64880031305832,2
2017,FACULDADE VERDE NORTE,FAVENORTE,Privada Com Fins Lucrativos,MG,1.84303498833426,2
2017,FACULDADE PAN AMAZÔNICA,FAPAN,Privada Com Fins Lucrativos,PA,2.06260327408258,3
2017,FACULDADE CIDADE DE PATOS DE MINAS,FPM,Privada Sem Fins Lucrativos,MG,1.89199320708728,2
2017,FACULDADE BRASIL NORTE,FABRAN,Privada Com Fins Lucrativos,AP,1.89224741658274,2
2017,FACULDADE DE ENSINO SUPERIOR DA AMAZÔNIA REUNIDA,FESAR,Privada Com Fins Lucrativos,PA,2.89561135567912,3
2017,FACULDADE DEL REY,FDR,Privada Com Fins Lucrativos,MG,1.781675594,2
2017,FACULDADE DE TALENTOS HUMANOS,FACTHUS,Privada Com Fins Lucrativos,MG,2.44831496727185,3
2017,FACULDADE DO SUL,,Privada Com Fins Lucrativos,BA,2.45984167720817,3
2017,FACULDADE DO BAIXO PARNAÍBA,FAP,Privada Com Fins Lucrativos,MA,2.50995045854186,3
2017,Centro Universitário FADERGS,FADERGS,Privada Com Fins Lucrativos,RS,2.92980577780839,3
2017,FACULDADE DO PANTANAL MATOGROSSENSE,FAPAN,Privada Com Fins Lucrativos,MT,2.94318809706492,3
2017,FACULDADE PROJEÇÃO DO GUARÁ,,Privada Sem Fins Lucrativos,DF,3.20278195151536,4
2017,INSTITUTO SUPERIOR DE EDUCAÇÃO OCIDENTE,OCIDEMNTE,Privada Sem Fins Lucrativos,BA,2.251007871,3
2017,FACULDADE BARRETOS,FB,Privada Com Fins Lucrativos,SP,2.61653166341306,3
2017,FACULDADE DE CIÊNCIAS HUMANAS E BIOLÓGICAS E DA SAÚDE,,Privada Com Fins Lucrativos,MT,2.87479856624107,3
2017,FACULDADE DE CIÊNCIAS JURÍDICAS E SOCIAIS APLICADAS DE PRIMAVERA DO LESTE,,Pessoa Jurídica De Direito Privado - Com Fins Lucrativos,MT,2.4163250475894,3
2017,FACULDADE CENECISTA DE SINOP,FACENOP,Privada Com Fins Lucrativos,MT,2.74591452722549,3
2017,INSTITUTO DE ENSINO SUPERIOR SANTA CECÍLIA,IESC,Privada Com Fins Lucrativos,AL,1.09309090778302,2
2017,FACULDADE DO INSTITUTO NACIONAL DE PÓS-GRADUAÇÃO DE SÃO JOSÉ DOS CAMPOS,FACULDADE INPG - SJC,Privada Com Fins Lucrativos,SP,2.67768698017373,3
2017,FAJOPA - FACULDADE JOÃO PAULO II,FAJOPA,Privada Sem Fins Lucrativos,SP,2.74745932438824,3
2017,FACULDADE SANTA RITA DE CÁSSIA,IFASC,Privada Com Fins Lucrativos,GO,2.34805474456033,3
2017,FACULDADE DE IBIPORÃ,,Privada Sem Fins Lucrativos,PR,2.12904308545596,3
2017,FACULDADE DA AMAZÔNIA,FAAM,Privada Com Fins Lucrativos,PA,2.23021645689364,3
2017,FACULDADE DELTA,FACDELTA,Privada Com Fins Lucrativos,BA,2.49301647738728,3
2017,CHRISTUS FACULDADE DO PIAUÍ,CHRISFAPI,Privada Com Fins Lucrativos,PI,2.94949651794349,4
2017,FACULDADE TEOLÓGICA DE CIÊNCIAS HUMANAS E SOCIAIS LOGOS,FAETEL,Privada Sem Fins Lucrativos,SP,2.042404629,3
2017,FACULDADE INTERNACIONAL DA PARAÍBA,FPB,Privada Com Fins Lucrativos,PB,2.70167781695601,3
2017,FACULDADE DE SAÚDE E DESENVOLVIMENTO HUMANO SANTO AGOSTINHO,FS,Privada Com Fins Lucrativos,MG,2.65511313949109,3
2017,FACULDADE DE ODONTOLOGIA DO RECIFE,FOR,Privada Sem Fins Lucrativos,PE,2.510940189,3
2017,FACULDADE PITÁGORAS DE DIVINÓPOLIS - FPD,FPD,Privada Com Fins Lucrativos,MG,2.47820561351041,3
2017,UNIVERSIDADE COMUNITÁRIA DA REGIÃO DE CHAPECÓ,UNOCHAPECÓ,Privada Sem Fins Lucrativos,SC,2.8423574251535,3
2017,INSTITUTO SUPERIOR DE EDUCAÇÃO ALMEIDA RODRIGUES,ISEAR,Privada Com Fins Lucrativos,GO,2.30913633,3
2017,FACULDADE DE TECNOLOGIA SENAI FLORIANÓPOLIS,SENAI -SC - CTAI,Privada Sem Fins Lucrativos,SC,2.70465096131169,3
2017,"INSTITUTO FEDERAL DE EDUCAÇÃO, CIÊNCIA E TECNOLOGIA DE ALAGOAS",IFAL,Pública Federal,AL,2.33257900997508,3
2017,"Instituto Federal de Educação, Ciência e Tecnologia do Sertão Pernambucano",IF Sertão,Pública Federal,PE,2.37951410236285,3
2017,"INSTITUTO FEDERAL DE EDUCAÇÃO, CIÊNCIA E TECNOLOGIA  DE SANTA CATARINA",IFSC,Pública Federal,SC,3.22598264554438,4
2017,"INSTITUTO FEDERAL DE EDUCAÇÃO, CIÊNCIA E TECNOLOGIA DO RIO DE JANEIRO",IFRJ,Pública Federal,RJ,3.03365452910526,4
2017,"INSTITUTO FEDERAL DE EDUCAÇÃO, CIÊNCIA E TECNOLOGIA DE MATO GROSSO",IFMT,Pública Federal,MT,2.48179458181282,3
2017,"INSTITUTO FEDERAL DE EDUCAÇÃO, CIÊNCIA E TECNOLOGIA  DO TRIÂNGULO MINEIRO",IFTM,Pública Federal,MG,2.66950291333611,3
2017,FACULDADE DE TECNOLOGIA IBTA CAMPINAS,IBTA,Pessoa Jurídica De Direito Privado - Com Fins Lucrativos,SP,3.17232519716713,4
2017,FACULDADE ESTÁCIO DE FLORIANÓPOLIS - ESTÁCIO FLORIANÓPOLIS,,Privada Com Fins Lucrativos,SC,2.61845321149063,3
2017,FACULDADE EQUIPE,,Privada Sem Fins Lucrativos,RS,2.54035060269492,3
2017,UNIVERSIDADE DO ESTADO DO AMAZONAS,UEA,Pública Estadual,AM,2.84557816502151,3
2017,FACULDADE DE ADMINISTRAÇÃO DA FESPSP,FADFESPSP,Privada Sem Fins Lucrativos,SP,2.29179133,3
2017,FACULDADE ATTICUS,,Privada Sem Fins Lucrativos,PR,2.845926815,3
2017,CENTRO DE ENSINO SUPERIOR ARCANJO MIKAEL DE ARAPIRACA,CESAMA,Privada Com Fins Lucrativos,AL,2.680717158,3
2017,"INSTITUTO FEDERAL DE EDUCAÇÃO, CIÊNCIA E TECNOLOGIA DE SERGIPE",IFS,Pública Federal,SE,2.61964876260858,3
2017,"INSTITUTO FEDERAL DE EDUCAÇÃO, CIÊNCIA E TECNOLOGIA DE RORAIMA",IFRR,Pública Federal,RR,2.12309350554442,3
2017,FACULDADE DE SÃO ROQUE,FAEV,Pessoa Jurídica De Direito Privado - Sem Fins Lucrativos,SP,1.42513450435135,2
2017,"INSTITUTO FEDERAL DE EDUCAÇÃO, CIÊNCIA E TECNOLOGIA DO NORTE DE MINAS GERAIS",IFNMG,Pública Federal,MG,2.4949733055399,3
2017,"INSTITUTO FEDERAL DE EDUCAÇÃO, CIÊNCIA E TECNOLOGIA DE MINAS GERAIS",IFMG,Pública Federal,MG,2.83893935846011,3
2017,FACULDADES INTEGRADAS DOS CAMPOS GERAIS,CESCAGE,Privada Com Fins Lucrativos,PR,1.94026846704948,2
2017,FACULDADE DE MINAS BH,FAMINAS-BH,Privada Com Fins Lucrativos,MG,2.67397609113452,3
2017,FACULDADE DE QUATRO MARCOS,FQM,Privada Com Fins Lucrativos,MT,2.6080909490591,3
2017,FACULDADE DE CIÊNCIAS BIOLÓGICAS E DA SAÚDE,FACISA,Privada Com Fins Lucrativos,MG,2.8036336528746,3
2017,FACULDADE DE ARAÇATUBA,,Pessoa Jurídica De Direito Privado - Sem Fins Lucrativos,SP,1.463456855,2
2017,ESCOLA SUPERIOR DE CIÊNCIAS DA SAÚDE,ESCS,Pessoa Jurídica De Direito Público - Estadual,DF,2.86489120339868,3
2017,FACULDADE LUIZ EDUARDO MAGALHÃES,FILEM,Privada Sem Fins Lucrativos,BA,2.860830595,3
2017,FI - FACULDADE IGUAÇU,FI,Privada Com Fins Lucrativos,PR,1.51341182641322,2
2017,FACULDADE QUIRINÓPOLIS,FAQUI,Pessoa Jurídica De Direito Privado - Com Fins Lucrativos,GO,2.12687999760852,3
2017,FACULDADE MADRE THAIS,FMT,Privada Com Fins Lucrativos,BA,2.03524113852217,3
2017,FACULDADE SÃO BENTO DA BAHIA,FSBB,Privada Sem Fins Lucrativos,BA,1.96835741694595,3
2017,"INSTITUTO FEDERAL DE EDUCAÇÃO, CIÊNCIA E TECNOLOGIA DO SUDESTE DE MINAS GERAIS",IFSEMG,Pública Federal,MG,2.81962417982131,3
2017,FACULDADE SANTO ANTONIO,FSA,Privada Com Fins Lucrativos,BA,2.63998141263869,3
2017,Centro Universitário Eniac,ENIAC,Privada Com Fins Lucrativos,SP,3.01463891219327,4
2017,FACULDADE SENAC FLORIANÓPOLIS,SENAC FLORIANÓPOLIS,Privada Sem Fins Lucrativos,SC,2.34512493628969,3
2017,FACULDADE DE TECNOLOGIA INFORMÁTICA,FATI,Privada Com Fins Lucrativos,CE,2.683568778,3
2017,FACULDADE DE JUNQUEIRÓPOLIS,ISEJ,Privada Sem Fins Lucrativos,SP,1.55613848,2
2017,Faculdade Invest de Ciências e Tecnologia,INVEST,Privada Sem Fins Lucrativos,MT,1.87926462450919,2
2017,FACULDADES INTEGRADAS DE PATOS,FIP,Privada Com Fins Lucrativos,PB,2.48661074573124,3
2017,FACULDADE DE TECNOLOGIA IPUC,FATIPUC,Privada Sem Fins Lucrativos,RS,1.516475801,2
2017,FACULDADE DE RIO CLARO,CBTA,Privada Com Fins Lucrativos,SP,2.702486369125,3
2017,FACULDADE DE TECNOLOGIA TERMOMECÂNICA,FTT,Privada Sem Fins Lucrativos,SP,3.09933434484071,4
2017,FACULDADE DE ENSINO SUPERIOR DE CATALÃO,FACULDADE CESUC,Privada Com Fins Lucrativos,GO,2.40473875842842,3
2017,INSTITUTO DE EDUCAÇÃO E ENSINO SUPERIOR DE CAMPINAS,IESCAMP,Privada Com Fins Lucrativos,SP,2.04244419577399,3
2017,FACULDADE DE TECNOLOGIA SENAC RIO,FATEC,Privada Sem Fins Lucrativos,RJ,2.24219629562749,3
2017,CENTRO UNIVERSITÁRIO UNIFTEC,,Privada Com Fins Lucrativos,RS,3.12219535522107,4
2017,UNIVERSIDADE ESTADUAL DO RIO GRANDE DO SUL,UERGS,Pública Estadual,RS,3.1909001157218,4
2017,FACULDADE DE TECNOLOGIA DE TERESINA,FACULDADE CET,Privada Com Fins Lucrativos,PI,1.59376321408621,2
2017,FACULDADE IDEAU DE GETÚLIO VARGAS,IDEAU,Privada Com Fins Lucrativos,RS,3.2427775756619,4
2017,FACULDADE GUARAÍ,FAG,Privada Com Fins Lucrativos,TO,1.58993353311906,2
2017,INSTITUTO SUPERIOR DE EDUCAÇÃO DE OLIVEIRA,ISEOL,Privada Sem Fins Lucrativos,MG,2.097632073,3
2017,CENTRO UNIVERSITÁRIO DO SUL DE MINAS,UNIS-MG,Privada Sem Fins Lucrativos,MG,3.24782579390156,4
2017,CENTRO UNIVERSITÁRIO DE PATOS DE MINAS,UNIPAM,Privada Sem Fins Lucrativos,MG,2.99978942181087,4
2017,CENTRO UNIVERSITÁRIO DE LAVRAS,UNILAVRAS,Privada Sem Fins Lucrativos,MG,2.64246042346221,3
2017,INSTITUTO DE ENSINO SUPERIOR MÚLTIPLO,IESM,Privada Com Fins Lucrativos,MA,2.50342091945909,3
2017,FACULDADE DE TEOLOGIA INTEGRADA,FATIN,Privada Sem Fins Lucrativos,PE,2.01371580057805,3
2017,FACULDADE MONTESSORIANO DE SALVADOR,FAMA,Privada Sem Fins Lucrativos,BA,2.10042593850943,3
2017,FACULDADE MISSIONEIRA DO PARANÁ,FAMIPAR,Privada Sem Fins Lucrativos,PR,2.780903146,3
2017,FACULDADE PARAÍSO DO CEARÁ,FAP,Privada Com Fins Lucrativos,CE,2.74754017152456,3
2017,FACULDADE RAÍZES,SER,Privada Sem Fins Lucrativos,GO,1.845039136,2
2017,FACULDADE DE ENSINO SUPERIOR DOM BOSCO,FACDOMBOSCO,Privada Com Fins Lucrativos,PR,2.00178063055433,3
2017,FACULDADE LS,FACELS,Privada Com Fins Lucrativos,DF,2.64279014630377,3
2017,"FACULDADE BOAS NOVAS DE CIÊNCIAS TEOLÓGICAS, SOCIAIS E BIOTECNOLÓGICAS",FBNCTSB,Privada Sem Fins Lucrativos,AM,2.59278537410093,3
2017,FACULDADE DE SAÚDE DE SÃO PAULO,FASSP,Privada Com Fins Lucrativos,SP,1.56133017987204,2
2017,FACULDADE DE JANDIRA,,Privada Com Fins Lucrativos,SP,2.17956840359596,3
2017,Faculdade Dom Pedro II de Sergipe,DP II Sergipe,Privada Sem Fins Lucrativos,SE,2.12029813375218,3
2017,FACULDADE ALFA AMÉRICA,,Privada Com Fins Lucrativos,SP,2.539057147,3
2017,"Faculdade Uberlandense de Núcleos Integrados de Ensino, Serviço Social e Aprendizagem",FAESSA,Pessoa Jurídica De Direito Privado - Sem Fins Lucrativos,MG,2.62947359042226,3
2017,FACULDADE DO SERIDÓ,FAS,Privada Com Fins Lucrativos,RN,1.656600849,2
2017,"FACULDADES INTEGRADAS DE CIÊNCIAS HUMANAS, SAÚDE E EDUCAÇÃO DE GUARULHOS",FG,Privada Sem Fins Lucrativos,SP,2.06718737751497,3
2017,FACULDADE DE SAÚDE IBITURUNA,FASI,Privada Com Fins Lucrativos,MG,2.53826434975692,3
2017,Faculdade de Araraquara,FARA,Privada Com Fins Lucrativos,SP,2.56423349950314,3
2017,Faculdade SOCIESC de Balneário Camboriú,,Privada Sem Fins Lucrativos,SC,2.43075908583146,3
2017,FACULDADE INEDI,CESUCA,Privada Com Fins Lucrativos,RS,3.61749747197405,4
2017,INSTITUTO SUPERIOR DE EDUCAÇÃO IBITURUNA,ISEIB,Privada Com Fins Lucrativos,MG,2.31030420729927,3
2017,FACULDADE POLITÉCNICA DE CAMPINAS,POLICAMP,Privada Sem Fins Lucrativos,SP,1.84520113338147,2
2017,Centro de Ensino Superior de Conselheiro Lafaiete,CES-CL,Privada Sem Fins Lucrativos,MG,2.45934272628056,3
2017,FACULDADE PINHALZINHO,HORUS,Privada Com Fins Lucrativos,SC,2.48854348308471,3
2017,FACULDADE DE ADMINISTRAÇÃO DE EMPRESAS IBRAFEM,IBRAFEM,Privada Com Fins Lucrativos,SP,NA,SC
2017,FACULDADE VICENTINA - FAVI,FAVI,Privada Sem Fins Lucrativos,PR,3.17468805153425,4
2017,FACULDADE DE PRESIDENTE VENCESLAU,FAPREV,Privada Com Fins Lucrativos,SP,2.02279164516393,3
2017,FACULDADE DE CIÊNCIAS GERENCIAIS ALVES FORTES,FACE - ALFOR,Privada Sem Fins Lucrativos,MG,1.907089158044,2
2017,FACULDADES INTEGRADAS DA VITÓRIA DE SANTO ANTÃO,FAINTVISA,Privada Com Fins Lucrativos,PE,2.88823110308097,3
2017,FACULDADE DE CIÊNCIAS DA SAÚDE ARCHIMEDES THEODORO,FAC - SAUDE ARTHE,Pessoa Jurídica De Direito Público - Municipal,MG,1.18633574411284,2
2017,FACULDADE JANGADA,FJ,Privada Com Fins Lucrativos,SC,2.33509420908911,3
2017,FACULDADE CATÓLICA DE POUSO ALEGRE,FACAPA,Privada Sem Fins Lucrativos,MG,3.4015752376962,4
2017,FACULDADE DE DIREITO DA FUNDAÇÃO ESCOLA SUPERIOR DO MINISTÉRIO PÚBLICO,,Privada Sem Fins Lucrativos,RS,3.13599222947342,4
2017,"FACULDADE EVANGÉLICA DE TECNOLOGIA, CIÊNCIAS E BIOTECNOLOGIA DA CGADB",FAECAD,Privada Sem Fins Lucrativos,RJ,1.736374704,2
2017,CENTRO UNIVERSITÁRIO EURÍPEDES DE MARÍLIA,UNIVEM,Privada Sem Fins Lucrativos,SP,2.68079987556124,3
2017,FACULDADE DE NANUQUE,FANAN,Privada Com Fins Lucrativos,MG,1.990677539,3
2017,FACULDADE CERES,FACERES,Pessoa Jurídica De Direito Privado - Com Fins Lucrativos,SP,2.10170248925714,3
2017,FACULDADE DE TEOLOGIA EVANGÉLICA EM CURITIBA - FATEV,FATEV,Privada Sem Fins Lucrativos,PR,2.441549267,3
2017,FACULDADE FAE SÉVIGNÉ PORTO ALEGRE,FAE SÉVIGNÉ,Privada Sem Fins Lucrativos,RS,3.493430192,4
2017,FACULDADE ANGLICANA DE TAPEJARA,FAT,Privada Sem Fins Lucrativos,RS,1.6086760754,2
2017,FACULDADE NOVO HAMBURGO,FACULDADE IENH,Privada Sem Fins Lucrativos,RS,3.10894434955279,4
2017,FACULDADE DE DESENVOLVIMENTO E INTEGRAÇÃO REGIONAL,FADIRE,Pessoa Jurídica De Direito Privado - Com Fins Lucrativos,PE,2.4854301551283,3
2017,FACULDADE TEOLÓGICA BATISTA DE BRASÍLIA,FTBB,Privada Sem Fins Lucrativos,DF,2.399462815,3
2017,INSTITUTO SUPERIOR DE EDUCAÇÃO SANTA CRUZ,ISED,Privada Com Fins Lucrativos,PE,1.876192812,2
2017,FACULDADE SANTA CRUZ,FACRUZ,Privada Com Fins Lucrativos,PE,1.186026226,2
2017,FACULDADE DIOCESANA SÃO JOSÉ,FADISI,Privada Sem Fins Lucrativos,AC,2.259787706,3
2017,FACULDADE DOM PEDRO II,FDPII,Privada Com Fins Lucrativos,BA,2.76400252558003,3
2017,FACULDADE DE ENFERMAGEM SÃO VICENTE DE PAULA,FESVIP,Pessoa Jurídica De Direito Privado - Com Fins Lucrativos,PB,2.488433826,3
2017,CENTRO UNIVERSITÁRIO AUTÔNOMO DO BRASIL,UNIBRASIL,Privada Com Fins Lucrativos,PR,2.90001884234755,3
2017,FACULDADE ANHANGUERA DE GUARULHOS,,Privada Com Fins Lucrativos,SP,2.52022172053947,3
2017,ESCOLA SUPERIOR ASSOCIADA DE GOIÂNIA,ESUP,Privada Com Fins Lucrativos,GO,2.55184904783626,3
2017,FACULDADES INTEGRADAS IPITANGA,FACIIP,Privada Com Fins Lucrativos,BA,1.60969648806636,2
2017,Faculdade ICESP de Brasília,,Privada Com Fins Lucrativos,DF,2.89888609032696,3
2017,FACULDADE ANHANGUERA DE VALINHOS,,Privada Com Fins Lucrativos,SP,2.17138758118592,3
2017,FACULDADES INTEGRADAS IESGO,IESGO,Privada Com Fins Lucrativos,GO,3.08151297468806,4
2017,ESCOLA DE CIÊNCIAS SOCIAIS,,Privada Sem Fins Lucrativos,RJ,4.74977140891796,5
2017,FACULDADE PERNAMBUCANA DE SAÚDE,FPS,Privada Sem Fins Lucrativos,PE,2.62709562987212,3
2017,FACULDADE DE CIÊNCIAS HUMANAS E EXATAS DO SERTÃO DO SÃO FRANCISCO,FACESF,Privada Com Fins Lucrativos,PE,2.196194199,3
2017,FACULDADE MARIO SCHENBERG,FMS,Privada Com Fins Lucrativos,SP,2.22461593093585,3
2017,FACULDADE CATÓLICA NOSSA SENHORA DAS VITÓRIAS,FCNSV,Privada Com Fins Lucrativos,RN,2.13244641742322,3
2017,FACULDADE DAMAS DA INSTRUÇÃO CRISTÃ,FADIC,Privada Sem Fins Lucrativos,PE,2.28357698460372,3
2017,CENTRO UNIVERSITÁRIO DA FUNDAÇÃO EDUCACIONAL DE BARRETOS,UNIFEB,Privada Sem Fins Lucrativos,SP,2.46923920251384,3
2017,FACULDADE CATÓLICA SANTA TERESINHA,FCST,Privada Com Fins Lucrativos,RN,1.95262133438074,3
2017,INSTITUTO DE ENSINO SUPERIOR DE CUIABÁ,,Privada Com Fins Lucrativos,MT,1.92261274423695,2
2017,FACULDADE CIDADE VERDE,FCV,Privada Com Fins Lucrativos,PR,2.68326221923197,3
2017,FACULDADE DE COMPUTAÇÃO DE MONTES CLAROS,FACOMP,Privada Com Fins Lucrativos,MG,2.27661477145029,3
2017,FACULDADE EVANGÉLICA,FE,Privada Com Fins Lucrativos,DF,3.06193505394662,4
2017,FACULDADE DOM LUIS DE ORLEANS E BRAGANÇA,FARRP,Privada Com Fins Lucrativos,BA,2.0532819388473,3
2017,SINAL - FACULDADE DE TEOLOGIA E FILOSOFIA,SINAL,Privada Sem Fins Lucrativos,AC,1.245065075,2
2017,FACULDADE PADRE DOURADO - FDR,FDR,Privada Com Fins Lucrativos,CE,3.56894445643679,4
2017,INSTITUTO SUPERIOR DE EDUCAÇÃO DO MUNICÍPIO DE ITAPERUNA,ISEMI,Pública Municipal,RJ,2.702259969,3
2017,FUNDAÇÃO DE ENSINO SUPERIOR DE CLEVELÂNDIA,FESC,Privada Sem Fins Lucrativos,PR,2.31740948455307,3
2017,FACULDADES INTEGRADAS DO VALE DO IVAÍ,,Privada Sem Fins Lucrativos,PR,2.78146402667457,3
2017,FACULDADE PEDRO II,FAPE2,Privada Com Fins Lucrativos,MG,2.34109791947883,3
2017,FACULDADE DE TECNOLOGIA IPEP DE CAMPINAS,FATEC CAMPINAS,Privada Sem Fins Lucrativos,SP,1.57386097779339,2
2017,FACULDADE DE TECNOLOGIA IPEP DE SÃO PAULO,FATEC SP,Privada Sem Fins Lucrativos,SP,2.39685435755,3
2017,FACULDADE DE TECNOLOGIA SAINT PASTOUS,FSP,Privada Sem Fins Lucrativos,RS,1.579414596,2
2017,ESCOLA SUPERIOR NACIONAL DE SEGUROS,ESNS,Privada Sem Fins Lucrativos,RJ,3.778116953,4
2017,FACULDADE CIÊNCIAS DA VIDA,FCV,Pessoa Jurídica De Direito Privado - Com Fins Lucrativos,MG,2.35077253301536,3
2017,FACULDADE MARANHENSE SÃO JOSÉ DOS COCAIS,FSJ,Privada Com Fins Lucrativos,MA,1.86897620126699,2
2017,FACULDADE DE EDUCAÇÃO DE BACABAL - FEBAC,FEBAC,Privada Com Fins Lucrativos,MA,2.42956488158608,3
2017,FACULDADE DE JACAREÍ,,Privada Com Fins Lucrativos,SP,1.80092487714885,2
2017,FACULDADE PAULISTA DE PESQUISA E ENSINO SUPERIOR,FAPPES,Privada Com Fins Lucrativos,SP,2.902337293,3
2017,FACULDADES INTEGRADAS DOM PEDRO II,DOMPEDRO,Privada Sem Fins Lucrativos,SP,1.31589832914729,2
2017,FACULDADES INTEGRADAS ADVENTISTAS DE MINAS GERAIS,FADMINAS,Privada Sem Fins Lucrativos,MG,2.53627725888976,3
2017,ALFA - Faculdade de Almenara,,Privada Com Fins Lucrativos,MG,1.29034704082813,2
2017,FACULDADE SERRA DA MESA,FASEM,Privada Com Fins Lucrativos,GO,2.11487837081439,3
2017,Faculdade SOCIESC,,Privada Sem Fins Lucrativos,SC,3.30859472975349,4
2017,Faculdade Itaboraí,,Privada Sem Fins Lucrativos,RJ,1.80840785013529,2
2017,Faculdade IBGEN,,Privada Com Fins Lucrativos,RS,2.38815227609467,3
2017,FACULDADE MADRE TEREZA,FAMAT,Privada Com Fins Lucrativos,AP,2.21853713116605,3
2017,FACULDADE TEOLÓGICA BATISTA DE SÃO PAULO,FTBSP,Privada Sem Fins Lucrativos,SP,2.743025966,3
2017,Faculdade IBGEN,IBGEN,Privada Com Fins Lucrativos,RS,1.99853545864062,3
2017,FACULDADE SÃO TOMAZ DE AQUINO,FSTA,Privada Com Fins Lucrativos,BA,NA,SC
2017,INSTITUTO DE ENSINO SUPERIOR DE MATO GROSSO,IESMT,Privada Sem Fins Lucrativos,MT,1.88453392722074,2
2017,FACULDADE DE ARACAJU,FACAR,Privada Sem Fins Lucrativos,SE,1.91266383301887,2
2017,FACULDADE ESTÁCIO DE SANTO ANDRÉ,ESTÁCIO SANTO ANDRÉ,Privada Com Fins Lucrativos,SP,2.67844030984034,3
2017,FACULDADE PARAENSE DE ENSINO,FAPEN,Privada Sem Fins Lucrativos,PA,2.16589647157034,3
2017,INSTITUTO DE ENSINO SUPERIOR DO RIO GRANDE DO NORTE,IESRN,Privada Sem Fins Lucrativos,RN,1.81013085850215,2
2017,INSTITUTO MARANHENSE DE ENSINO E CULTURA,IMEC,Privada Sem Fins Lucrativos,MA,1.84407541572529,2
2017,FACULDADE DE ENSINO DE MINAS GERAIS,FACEMG,Privada Sem Fins Lucrativos,MG,2.30968281402639,3
2017,FACULDADE JUIZ DE FORA,FJF,Privada Sem Fins Lucrativos,MG,2.65557096112444,3
2017,FACULDADE EVANGÉLICA DE GOIANÉSIA,,Privada Sem Fins Lucrativos,GO,2.6801969376661,3
2017,FACULDADE DE TECNOLOGIA ENSITEC,ENSITEC,Privada Com Fins Lucrativos,PR,1.484275364,2
2017,FACULDADE DE FRUTAL,FAF,Privada Com Fins Lucrativos,MG,1.7963903085,2
2017,FACULDADE GUAIRACÁ,FAG,Privada Com Fins Lucrativos,PR,2.79362371677735,3
2017,FACULDADE JAUENSE,,Pessoa Jurídica De Direito Privado - Com Fins Lucrativos,SP,1.966530473,3
2017,FACULDADE SENAC PORTO ALEGRE - FSPOA,SENAC/RS,Privada Sem Fins Lucrativos,RS,2.40182573796843,3
2017,FACULDADE DE TECNOLOGIA DA PARAÍBA,FATECPB,Privada Com Fins Lucrativos,PB,2.6820816208656,3
2017,FACULDADE DE DIREITO DE ALTA FLORESTA,,Privada Sem Fins Lucrativos,MT,1.710092318,2
2017,FACULDADE UNINASSAU JOÃO PESSOA,,Privada Sem Fins Lucrativos,PB,2.45779400051326,3
2017,INSTITUTO DE EDUCAÇÃO SUPERIOR DE POUSO ALEGRE,FAPA,Privada Com Fins Lucrativos,MG,2.577691679,3
2017,FACULDADE DE SALVADOR,,Privada Sem Fins Lucrativos,BA,2.00105117479676,3
2017,FACULDADE ESTÁCIO DE JOÃO PESSOA - ESTÁCIO DE JOÃO PESSOA,ESTÁCIO DE JOÃO PESS,Privada Com Fins Lucrativos,PB,3.08845986187234,4
2017,Faculdade IPEMED de Ciências Médicas,IPEMED,Privada Com Fins Lucrativos,MG,1.879604045,2
2017,CENTRO UNIVERSITÁRIO FACVEST,UNIFACVEST,Privada Com Fins Lucrativos,SC,3.63676334991244,4
2017,FACULDADE BAIANA DE DIREITO E GESTÃO,,Privada Com Fins Lucrativos,BA,2.763928619,3
2017,FUNDAÇÃO UNIVERSIDADE FEDERAL DO TOCANTINS,UFT,Pública Federal,TO,2.92648417427464,3
2017,FACULDADE UNINASSAU NATAL,,Privada Com Fins Lucrativos,RN,2.52296727610652,3
2017,FACULDADE IDEAL DE BRASÍLIA,IDEAL,Privada Com Fins Lucrativos,DF,2.30335887123158,3
2017,FACULDADE LUCIANO FEIJÃO,FLF,Privada Sem Fins Lucrativos,CE,2.94477826887985,3
2017,FACULDADE REGIONAL DE ALAGOINHAS,FARAL,Privada Com Fins Lucrativos,BA,2.61726754067193,3
2017,FACULDADE BRASILEIRA DE EDUCAÇÃO E CULTURA,FABEC BRASIL,Privada Com Fins Lucrativos,GO,2.13984471842697,3
2017,FACULDADE MAUÁ DE BRASÍLIA,MAUADF,Privada Com Fins Lucrativos,DF,3.46920554493038,4
2017,INSTITUTO FLORENCE DE ENSINO SUPERIOR,IFES,Privada Com Fins Lucrativos,MA,2.70865869756948,3
2017,CENTRO UNIVERSITÁRIO DA FUNDAÇÃO EDUCACIONAL GUAXUPÉ,UNIFEG,Privada Sem Fins Lucrativos,MG,2.53693394988939,3
2017,Faculdade Unyleya,,Privada Com Fins Lucrativos,RJ,2.7929561171474,3
2017,FACULDADE BRASIL CENTRAL,FBC,Privada Com Fins Lucrativos,GO,3.12110691302128,4
2017,FACULDADE DECISION DE NEGÓCIOS,FACULDADE DECISION,Privada Com Fins Lucrativos,RS,3.643372122,4
2017,Centro Universitário Maurício de Nassau de Campina Grande,UNINASSAU CPV,Privada Com Fins Lucrativos,PB,2.62917932763293,3
2017,FACULDADE DE INTEGRAÇÃO DO SERTÃO,FIS,Privada Com Fins Lucrativos,PE,2.13269703083082,3
2017,FACULDADE MUNDIAL,,Privada Sem Fins Lucrativos,SP,3.144637226,4
2017,FACULDADE ARNALDO HORÁCIO FERREIRA,FAAHF,Privada Com Fins Lucrativos,BA,2.61418666754902,3
2017,INSTITUTO DE EDUCAÇÃO SUPERIOR RAIMUNDO SÁ,IESRSA,Privada Com Fins Lucrativos,PI,2.74796098619988,3
2017,FACULDADE MÉTODO DE SÃO PAULO,FAMESP,Privada Com Fins Lucrativos,SP,2.56393290403409,3
2017,FACULDADE ANHANGUERA DE LIMEIRA,,Privada Com Fins Lucrativos,SP,2.37768901028303,3
2017,Faculdade Anhanguera de Indaiatuba,,Privada Com Fins Lucrativos,SP,2.08440686261105,3
2017,FACULDADE ALIANÇA,,Privada Com Fins Lucrativos,GO,1.61591075551908,2
2017,FACULDADE DE ENSINO SUPERIOR SANTA BARBARA,FAESB,Privada Sem Fins Lucrativos,SP,1.96915661825256,3
2017,FACULDADE DE TECNOLOGIA SENAC TUBARÃO,SENAC,Privada Sem Fins Lucrativos,SC,2.55727906078182,3
2017,FACULDADE DE TECNOLOGIA SENAC BLUMENAU,SENAC,Privada Sem Fins Lucrativos,SC,2.7089451178,3
2017,FACULDADE DE CIÊNCIAS JURÍDICAS E GERENCIAIS DE OLIVEIRA,FACIJUGO,Privada Sem Fins Lucrativos,MG,3.10152402925974,4
2017,FACULDADES INTEGRADAS DE CATAGUASES,FIC,Privada Sem Fins Lucrativos,MG,3.20528698056513,4
2017,CENTRO UNIVERSITÁRIO SENAI CIMATEC,SENAI CIMATEC,Privada Sem Fins Lucrativos,BA,3.65029607233653,4
2017,CENTRO UNIVERSITÁRIO DE CARATINGA,UNEC,Privada Sem Fins Lucrativos,MG,2.71472934871582,3
2017,CENTRO SUPERIOR DE ENSINO E PESQUISA DE MACHADO,CESEP,Privada Sem Fins Lucrativos,MG,2.44178960688657,3
2017,UNIVERSIDADE DE RIO VERDE,FESURV,Pública Municipal,GO,2.59914250377057,3
2017,FACULDADE SÃO FRANCISCO DE PIUMHI,FASPI,Privada Com Fins Lucrativos,MG,1.414284378,2
