Ano,Nome da IES,Sigla da IES,Categ. Administrativa,UF da IES,IGC (Contínuo),IGC (Faixa)
2017,FACULDADE DE MIRASSOL,,Privada Com Fins Lucrativos,SP,2.15005492033882,3
2017,"INSTITUTO FEDERAL DE EDUCAÇÃO, CIÊNCIA E TECNOLOGIA FLUMINENSE",IF Fluminense,Pública Federal,RJ,2.88810425775883,3
2017,FACULDADE REGES DE OSVALDO CRUZ,,Privada Sem Fins Lucrativos,SP,2.69586740252069,3
2017,INSTITUTO DE EDUCAÇÃO SUPERIOR UNYAHNA DE SALVADOR,IESUS,Privada Com Fins Lucrativos,BA,2.103528771,3
2017,INSTITUTO DE EDUCAÇÃO SUPERIOR UNYAHNA DE BARREIRAS,IESUB,Privada Com Fins Lucrativos,BA,2.12179022992891,3
2017,FACULDADES INTEGRADAS ESPÍRITA,FIES,Privada Sem Fins Lucrativos,PR,2.14056270861539,3
2017,UNIVERSIDADE ESTADUAL DO CENTRO OESTE,UNICENTRO,Pública Estadual,PR,3.58107848330862,4
2017,UNIVERSIDADE DE ITAÚNA,UI,Privada Sem Fins Lucrativos,MG,2.22703127183668,3
2017,CENTRO UNIVERSITÁRIO DO NORTE PAULISTA,UNORP,Privada Sem Fins Lucrativos,SP,2.28375739913304,3
2017,FACULDADE METODISTA DE CIÊNCIAS HUMANAS E EXATAS,METODISTA,Privada Sem Fins Lucrativos,SP,2.27168889568627,3
2017,CENTRO UNIVERSITÁRIO SANTO AGOSTINHO,UNIFSA,Privada Com Fins Lucrativos,PI,2.59721231469715,3
2017,FACULDADE DE CIÊNCIAS HUMANAS E SOCIAIS DE IGARASSU,FACIG,Privada Sem Fins Lucrativos,PE,2.719216540546,3
2017,FACULDADE DE ESTUDOS ADMINISTRATIVOS DE MINAS GERAIS - FEAD-MG,FEAD - MG,Privada Com Fins Lucrativos,MG,1.94305240486545,2
2017,FACULDADE GAMA E SOUZA,FGS,Privada Sem Fins Lucrativos,RJ,2.41813365701499,3
2017,FACULDADES INTEGRADAS DE VITÓRIA,FDV,Pessoa Jurídica De Direito Privado - Com Fins Lucrativos,ES,3.64709135055644,4
2017,Faculdade de Ciências de Timbaúba,FACET,Privada Sem Fins Lucrativos,PE,2.794361018,3
2017,FACULDADE DE CIÊNCIAS HUMANAS,IMENSU,Privada Sem Fins Lucrativos,SP,2.119796872,3
2017,CENTRO UNIVERSITÁRIO NOSSA SENHORA DO PATROCÍNIO,CEUNSP,Privada Com Fins Lucrativos,SP,3.23973253549965,4
2017,FACULDADE DE ADMINISTRAÇÃO E NEGÓCIOS DE SERGIPE,FANESE,Privada Com Fins Lucrativos,SE,3.17775048012788,4
2017,UNIVERSIDADE CÂNDIDO MENDES,UCAM,Privada Sem Fins Lucrativos,RJ,2.13720282136372,3
2017,FACULDADE SALESIANA DE SANTA TERESA,FSST,Privada Sem Fins Lucrativos,MS,1.87569340445913,2
2017,FACULDADE CNEC ITABORAÍ,,Privada Sem Fins Lucrativos,RJ,2.38888066091177,3
2017,ESCOLA SUPERIOR SÃO FRANCISCO DE ASSIS,ESFA,Privada Sem Fins Lucrativos,ES,1.93650152337557,2
2017,CENTRO DE ENSINO SUPERIOR DE VITÓRIA,CESV,Privada Com Fins Lucrativos,ES,2.016551551,3
2017,FACULDADE CAMBURY,CAMBURY,Privada Com Fins Lucrativos,GO,2.06362700578681,3
2017,INSPER INSTITUTO DE ENSINO E PESQUISA,INSPER,Privada Sem Fins Lucrativos,SP,4.03657182674286,5
2017,FACULDADE DE ALTA FLORESTA,FAF,Privada Sem Fins Lucrativos,MT,2.24769528086486,3
2017,"INSTITUTO FEDERAL DE EDUCAÇÃO, CIÊNCIA E TECNOLOGIA  DA PARAÍBA",IFPB,Pública Federal,PB,2.88988930172319,3
2017,FACULDADE METROPOLITANA DE CAMAÇARI,FAMEC,Privada Sem Fins Lucrativos,BA,2.91476631135326,3
2017,FACULDADE ANHANGUERA DE BRASÍLIA,,Privada Com Fins Lucrativos,DF,2.27879925261535,3
2017,FACULDADE DE SABARÁ,SOECS,Privada Sem Fins Lucrativos,MG,1.59721348637306,2
2017,FACULDADE ESTÁCIO DO RIO GRANDE DO SUL - ESTÁCIO FARGS,ESTÁCIO FARGS,Privada Sem Fins Lucrativos,RS,2.39933659861162,3
2017,INSTITUTO DE ENSINO SUPERIOR DE AMERICANA,IESA,Privada Sem Fins Lucrativos,SP,3.01481399866667,4
2017,CENTRO UNIVERSITÁRIO JORGE AMADO,UNIJORGE,Privada Com Fins Lucrativos,BA,2.92387781090904,3
2017,CENTRO UNIVERSITÁRIO MÓDULO,MÓDULO,Privada Com Fins Lucrativos,SP,2.46003427946738,3
2017,UNIVERSIDADE DO PLANALTO CATARINENSE,UNIPLAC,Privada Sem Fins Lucrativos,SC,2.40623132300748,3
2017,FACULDADE INTEGRAL CANTAREIRA,F.I.C.,Privada Sem Fins Lucrativos,SP,2.87791792166448,3
2017,INSTITUTO DE ENSINO SUPERIOR DE FORTALEZA,IESF,Privada Sem Fins Lucrativos,CE,2.39523183151489,3
2017,CENTRO UNIVERSITÁRIO DE MARINGÁ - UNICESUMAR,UNICESUMAR,Privada Com Fins Lucrativos,PR,3.20005291193233,4
2017,FACULDADE DE CIÊNCIAS SOCIAIS E APLICADAS DO PARANÁ,FACET,Privada Com Fins Lucrativos,PR,2.22635731380081,3
2017,FACULDADE DE ADMINISTRAÇÃO MILTON CAMPOS,FAMC,Pessoa Jurídica De Direito Privado - Sem Fins Lucrativos,MG,2.21390802797348,3
2017,FACULDADE SANTA RITA,FASAR,Privada Com Fins Lucrativos,MG,2.59375018286797,3
2017,FACULDADE EDUCACIONAL DA LAPA,FAEL,Privada Com Fins Lucrativos,PR,2.43916217970475,3
2017,FAL ESTÁCIO - FACULDADE ESTÁCIO DE NATAL,,Privada Sem Fins Lucrativos,RN,2.81767452163891,3
2017,FACULDADE DE CIÊNCIAS CONTÁBEIS DE ASSIS,FCCA,Privada Sem Fins Lucrativos,SP,1.801410843,2
2017,FACULDADE FLEMING,SEF,Privada Sem Fins Lucrativos,SP,1.86020216096133,2
2017,INSTITUTO ITAPETININGANO DE ENSINO SUPERIOR,IIES,Privada Com Fins Lucrativos,SP,1.99644846794043,3
2017,FACULDADE GAMMON,,Privada Sem Fins Lucrativos,SP,1.89464854440171,2
2017,CENTRO UNIVERSITÁRIO DE JALES,UNIJALES,Privada Sem Fins Lucrativos,SP,2.05093412945261,3
2017,CENTRO UNIVERSITÁRIO AMPARENSE,UNIFIA,Privada Com Fins Lucrativos,SP,2.39485704848767,3
2017,INSTITUTO DE ENSINO SUPERIOR DO ACRE,IESACRE,Privada Com Fins Lucrativos,AC,3.00251091479605,4
2017,FACULDADE SÃO FRANCISCO DE BARREIRAS - FASB,FASB,Privada Sem Fins Lucrativos,BA,2.54657065019407,3
2017,CENTRO REGIONAL UNIVERSITÁRIO DE ESPÍRITO SANTO DO PINHAL,UNIPINHAL,Privada Sem Fins Lucrativos,SP,2.41284721673844,3
2017,FACULDADE CNEC SANTO ÂNGELO,,Privada Sem Fins Lucrativos,RS,2.77216178329717,3
2017,CENTRO UNIVERSITÁRIO CAMPOS DE ANDRADE,UNIANDRADE,Privada Sem Fins Lucrativos,PR,3.00719851769636,4
2017,CENTRO UNIVERSITÁRIO UNIC,,Privada Com Fins Lucrativos,MT,2.41734662948545,3
2017,FACULDADE NOSSA SENHORA APARECIDA,FANAP,Privada Sem Fins Lucrativos,GO,2.71571284795309,3
2017,FACULDADE PADRÃO,PADRAO,Privada Com Fins Lucrativos,GO,2.33022048567465,3
2017,FACULDADE DE ESTUDOS SOCIAIS DO ESPÍRITO SANTO,PIO XII,Privada Sem Fins Lucrativos,ES,2.95588767855096,4
2017,Faculdade Doctum da Serra,DOCTUM,Privada Sem Fins Lucrativos,ES,2.69338356375481,3
2017,FACULDADE BRASILEIRA,MULTIVIX VITÓRIA,Privada Com Fins Lucrativos,ES,3.51684760803662,4
2017,Faculdade de Castelo - Multivix Castelo,Multivix Castelo,Pessoa Jurídica De Direito Privado - Com Fins Lucrativos,ES,3.97077149213014,5
2017,FACULDADE CANDIDO MENDES DE VITÓRIA,FCMV,Privada Sem Fins Lucrativos,ES,0.756251599037383,1
2017,FACULDADE DE EDUCAÇÃO DE COSTA RICA,FECRA,Privada Sem Fins Lucrativos,MS,2.152790912375,3
2017,FACULDADE PROMOVE DE MINAS GERAIS,PROMOVE,Privada Sem Fins Lucrativos,MG,2.63066488925876,3
2017,FACULDADE METODISTA GRANBERY,FMG,Privada Sem Fins Lucrativos,MG,2.63410250518601,3
2017,FACULDADE DE ADMINISTRAÇÃO DE ITABIRITO,FAI,Pessoa Jurídica De Direito Privado - Sem Fins Lucrativos,MG,1.961488119,3
2017,Centro Universitário FBV Wyden,UniFBV WYDEN,Privada Com Fins Lucrativos,PE,3.0145267474296,4
2017,FACULDADE DOM BOSCO,DOM BOSCO,Privada Sem Fins Lucrativos,PR,3.18250960657796,4
2017,"FACULDADE DE ADMINISTRAÇÃO, CIÊNCIAS, EDUCAÇÃO E LETRAS",FACEL,Privada Sem Fins Lucrativos,PR,1.86587168624765,2
2017,FACULDADE DE CASCAVEL,,Privada Com Fins Lucrativos,PR,2.38187186855753,3
2017,FACULDADE BEZERRA DE ARAÚJO,FABA,Privada Com Fins Lucrativos,RJ,2.03453148582576,3
2017,CENTRO UNIVERSITÁRIO DO RIO GRANDE DO NORTE,UNI-RN,Privada Sem Fins Lucrativos,RN,3.28413039062495,4
2017,FACULDADES INTEGRADAS URUBUPUNGÁ,FIU,Privada Sem Fins Lucrativos,SP,1.95991982872444,3
2017,INSTITUTO DE ENSINO SUPERIOR DA GRANDE FLORIANÓPOLIS,IESGF,Privada Com Fins Lucrativos,SC,2.33011131479565,3
2017,CENTRO UNIVERSITÁRIO ESTÁCIO DE RIBEIRÃO PRETO,ESTÁCIO RIBEIRÃO PRE,Privada Com Fins Lucrativos,SP,2.54813318666422,3
2017,FACULDADE SANT´ANNA DE SALTO,FASAS,Privada Sem Fins Lucrativos,SP,NA,SC
2017,Centro Universitário Campo Limpo Paulista,UNIFACCAMP,Privada Com Fins Lucrativos,SP,2.29518873697684,3
2017,FACULDADE DO GUARUJÁ,FAGU,Privada Com Fins Lucrativos,SP,1.80658115188123,2
2017,INSTITUTO TAUBATÉ DE ENSINO SUPERIOR,I.T.E.S.,Privada Sem Fins Lucrativos,SP,2.86078684442899,3
2017,FACULDADE DE ITÁPOLIS - FACITA,FACITA,Privada Com Fins Lucrativos,SP,2.65399462353979,3
2017,Faculdade Estácio Cotia,Estácio FAAC,Privada Com Fins Lucrativos,SP,2.486607075,3
2017,FACULDADE DE CIÊNCIAS SOCIAIS E AGRÁRIAS DE ITAPEVA,FAIT,Privada Com Fins Lucrativos,SP,3.28653355059003,4
2017,FACULDADE DE DIREITO DA FUNDAÇÃO ARMANDO ALVARES PENTEADO,FAD-FAAP,Privada Sem Fins Lucrativos,SP,2.438641773,3
2017,Faculdade Álvares de Azevedo,FAATESP,Privada Com Fins Lucrativos,SP,2.37504312574419,3
2017,FACULDADE DE SANTO ANTONIO DA PLATINA,,Privada Com Fins Lucrativos,PR,2.4743242129062,3
2017,Centro Universitário de Adamantina,FAI,Especial,SP,2.37340820610884,3
2017,Centro Universitário das Américas,CAM,Privada Com Fins Lucrativos,SP,2.7446724158913,3
2017,ESCOLA SUPERIOR DE MARKETING,ESM,Privada Sem Fins Lucrativos,PE,1.94073345068116,2
2017,Faculdade Estácio de Alagoas - Estácio FAL,ESTÁCIO FAL,Privada Com Fins Lucrativos,AL,2.48669133996322,3
2017,FACULDADES INTEGRADAS DE FERNANDÓPOLIS,FIFE,Privada Sem Fins Lucrativos,SP,2.82121934260123,3
2017,INSTITUTO TAQUARITINGUENSE DE ENSINO SUPERIOR DR. ARISTIDES DE CARVALHO SCHLOBACH,ITES,Privada Sem Fins Lucrativos,SP,2.030228189082,3
2017,INSTITUTO MATONENSE MUNICIPAL DE ENSINO SUPERIOR,IMMES,Pessoa Jurídica De Direito Privado - Com Fins Lucrativos,SP,2.71472169885666,3
2017,FACULDADE BATISTA BRASILEIRA,FBB,Privada Sem Fins Lucrativos,BA,2.10326263921964,3
2017,"INSTITUTO FEDERAL DE EDUCAÇÃO, CIÊNCIA E TECNOLOGIA GOIANO",IF Goiano,Pública Federal,GO,3.27620736683077,4
2017,FACULDADE DE RIBEIRÃO PIRES,,Privada Sem Fins Lucrativos,SP,2.54666354620022,3
2017,"FACULDADE DE CIÊNCIAS JURÍDICAS, GERENCIAIS E EDUCAÇÃO DE SINOP",FIS,Privada Com Fins Lucrativos,MT,3.18375467126577,4
2017,FACULDADE DE ENSINO SUPERIOR E FORMAÇÃO INTEGRAL,FAEF,Privada Com Fins Lucrativos,SP,2.53666859383593,3
2017,FACULDADE NOVO MILÊNIO,FNM,Privada Com Fins Lucrativos,ES,2.17289536658242,3
2017,Faculdade Projeção de Taguatinga Norte,FAPRO,Privada Com Fins Lucrativos,DF,3.21949656603319,4
2017,FACULDADE DE AMERICANA,FAM,Privada Sem Fins Lucrativos,SP,2.47126073720023,3
2017,TREVISAN ESCOLA SUPERIOR DE NEGÓCIOS,TREVISAN,Privada Com Fins Lucrativos,SP,3.23376315313488,4
2017,FACULDADES INTEGRADAS DE RONDONÓPOLIS,FAIR,Privada Com Fins Lucrativos,MT,2.37116401628903,3
2017,FACULDADE DE SUZANO,UNISUZ,Privada Sem Fins Lucrativos,SP,2.38910128661272,3
2017,Centro Universitário Sudoeste Paulista,UniFSP,Privada Com Fins Lucrativos,SP,2.69335621375695,3
2017,FACULDADE MAURÍCIO DE NASSAU DE VITÓRIA DA CONQUISTA,FMN,Privada Com Fins Lucrativos,BA,2.26775515936438,3
2017,FACULDADE TECSOMA,FATEC,Privada Com Fins Lucrativos,MG,2.19852127871866,3
2017,FACULDADE EDUVALE DE AVARÉ,EDUVALE,Privada Sem Fins Lucrativos,SP,3.27871668604555,4
2017,FACULDADE DE APUCARANA,FAP,Privada Sem Fins Lucrativos,PR,2.46642971986164,3
2017,FACULDADE CAPIXABA DA SERRA,MULTIVIX SERRA,Privada Com Fins Lucrativos,ES,3.16827510654297,4
2017,ESCOLA SUPERIOR DE PROPAGANDA E MARKETING DE PORTO ALEGRE,ESPM - POA,Privada Sem Fins Lucrativos,RS,3.3426675111259,4
2017,FACULDADE DE COMUNICAÇÃO E TURISMO DE OLINDA,FACOTTUR,Privada Sem Fins Lucrativos,PE,2.1318990097082,3
2017,FACULDADE COTEMIG,COTEMIG,Privada Com Fins Lucrativos,MG,2.79096084575685,3
2017,CENTRO UNIVERSITÁRIO FACISA,,Privada Com Fins Lucrativos,PB,2.96942602160824,4
2017,CENTRO UNIVERSITÁRIO ASSIS GURGACZ,FAG,Privada Sem Fins Lucrativos,PR,2.92820790981513,3
2017,FACULDADE MATER DEI,FMD,Privada Com Fins Lucrativos,PR,2.49231918524544,3
2017,FACULDADE BORGES DE MENDONÇA,FBM,Privada Com Fins Lucrativos,SC,2.29972952435294,3
2017,FACULDADE ANHANGUERA DE OSASCO,,Privada Com Fins Lucrativos,SP,2.10798441047721,3
2017,FACULDADE BATISTA DE MINAS GERAIS,FBMG,Privada Sem Fins Lucrativos,MG,1.95196342229515,3
2017,FACULDADE DO VALE DO JAGUARIBE,FVJ,Privada Com Fins Lucrativos,CE,2.40145200992568,3
2017,CENTRO UNIVERSITÁRIO SOCIESC,,Privada Sem Fins Lucrativos,SC,3.12128030189122,4
2017,INSTITUTO DE ENSINO SUPERIOR DE GARÇA,IESG,Privada Com Fins Lucrativos,SP,2.52179842575,3
2017,FACULDADES INTEGRADAS DE JAHU,FIJ,Privada Sem Fins Lucrativos,SP,2.70880094120567,3
2017,FACULDADES INTEGRADAS DE SANTA FÉ DO SUL,FUNEC,Pública Municipal,SP,2.61901186092486,3
2017,INSTITUTO SUPERIOR DE EDUCAÇÃO DO RIO DE JANEIRO,ISERJ,Pública Estadual,RJ,2.782081888,3
2017,FACULDADE CAPIXABA DE NOVA VENÉCIA,MULTIVIX NOVA VENÉCI,Privada Com Fins Lucrativos,ES,3.65610811359179,4
2017,FACULDADE SÃO GABRIEL,FSG,Pessoa Jurídica De Direito Privado - Com Fins Lucrativos,PI,2.39977456909091,3
2017,FACULDADE UBAENSE OZANAM COELHO,FAGOC,Privada Com Fins Lucrativos,MG,2.86264357715201,3
2017,FACULDADE VISCONDE DE CAIRÚ,FAVIC,Privada Sem Fins Lucrativos,BA,2.52237573871196,3
2017,FACULDADE DE TECNOLOGIA E CIÊNCIAS DE VITÓRIA DA CONQUISTA,FTC,Privada Com Fins Lucrativos,BA,3.09096260173656,4
2017,CENTRO UNIVERSITÁRIO ADVENTISTA DE SÃO PAULO,UNASP,Privada Sem Fins Lucrativos,SP,2.85079676532972,3
2017,FACULDADE DE MIRANDÓPOLIS,FAM,Privada Com Fins Lucrativos,SP,2.74863160415789,3
2017,FACULDADE CASA BRANCA,FACAB,Privada Com Fins Lucrativos,SP,2.77553821384615,3
2017,FACULDADE DE CIÊNCIAS SOCIAIS DE GUARANTÃ DO NORTE,FCSGN,Privada Sem Fins Lucrativos,MT,2.46321414623276,3
2017,FACULDADE CATÓLICA RAINHA DA PAZ DE ARAPUTANGA,FCARP,Privada Sem Fins Lucrativos,MT,2.04574172789802,3
2017,FACULDADES INTEGRADAS SÃO PEDRO,FAESA,Privada Sem Fins Lucrativos,ES,3.31340615123123,4
2017,Faculdade Martha Falcão Wyden,FMF WYDEN,Privada Com Fins Lucrativos,AM,2.78109435812891,3
2017,Faculdades EST,EST,Privada Sem Fins Lucrativos,RS,4.1716821858475,5
2017,FACULDADE JOSÉ LACERDA FILHO DE CIÊNCIAS APLICADAS,FAJOLCA,Privada Sem Fins Lucrativos,PE,2.73136911208017,3
2017,FACULDADE SANTA HELENA,FSH,Privada Sem Fins Lucrativos,PE,3.07245051203154,4
2017,FACULDADES INTEGRADAS IPEP,FIPEP,Privada Sem Fins Lucrativos,SP,2.11825894628571,3
2017,FACULDADE ESAMC CAMPINAS,ESAMC,Privada Com Fins Lucrativos,SP,2.39812115855344,3
2017,FACULDADE OCTÓGONO,FOCO,Privada Com Fins Lucrativos,SP,3.22530593,4
2017,FACULDADE SUMARÉ,ISES,Privada Com Fins Lucrativos,SP,3.50852892753532,4
2017,FACULDADE CASTRO ALVES,FCA,Pessoa Jurídica De Direito Privado - Com Fins Lucrativos,BA,2.51544625522594,3
2017,FACULDADE DE CALDAS NOVAS,UNICALDAS,Privada Com Fins Lucrativos,GO,1.6831592484522,2
2017,Centro Universitário Dinâmica das Cataratas,UDC,Privada Com Fins Lucrativos,PR,2.72612427907437,3
2017,FACULDADE DA INDÚSTRIA SÃO JOSÉ DOS PINHAIS,FAIND/SJP,Privada Sem Fins Lucrativos,PR,2.91288174317995,3
2017,FACULDADE ADELMAR ROSADO,FAR,Privada Com Fins Lucrativos,PI,2.61144249496774,3
2017,INSTITUTO DE CIÊNCIAS SOCIAIS E HUMANAS,ICSH,Privada Com Fins Lucrativos,GO,1.32538899604128,2
2017,FACULDADE DE PIMENTA BUENO,FAP,Privada Com Fins Lucrativos,RO,3.25989092354545,4
2017,FACULDADE DE PIRACANJUBA,FAP,Privada Com Fins Lucrativos,GO,1.293112596,2
2017,FACULDADE DO CENTRO LESTE,UCL,Privada Sem Fins Lucrativos,ES,3.10454400396735,4
2017,FACULDADE ÁREA I WYDEN,ÁREA 1 WYDEN,Privada Com Fins Lucrativos,BA,2.74465549045495,3
2017,FACULDADE DOIS DE JULHO,F2J,Privada Sem Fins Lucrativos,BA,2.47912734807432,3
2017,FACULDADE ANHANGUERA DE JUNDIAÍ,,Privada Com Fins Lucrativos,SP,1.98256462715552,3
2017,FACULDADE DE PRIMAVERA,CESPRI,Privada Sem Fins Lucrativos,SP,1.95181230424496,3
2017,CENTRO UNIVERSITÁRIO SÃO LUCAS,UniSL,Privada Com Fins Lucrativos,RO,2.92603268375624,3
2017,FACULDADE CNEC CAMPO LARGO,,Privada Sem Fins Lucrativos,PR,2.44989070668974,3
2017,CENTRO UNIVERSITÁRIO TOLEDO,UNITOLEDO,Privada Com Fins Lucrativos,SP,2.96097934289539,4
2017,CENTRO UNIVERSITÁRIO CURITIBA,UNICURITIBA,Privada Com Fins Lucrativos,PR,2.95344895024626,4
2017,FACULDADES DE DRACENA,,Privada Sem Fins Lucrativos,SP,2.49705610242049,3
2017,CENTRO UNIVERSITÁRIO DO NORTE,UNINORTE,Privada Com Fins Lucrativos,AM,2.76850705588837,3
2017,FACULDADE IDEAL WYDEN,FACI WYDEN,Privada Com Fins Lucrativos,PA,2.80239568902989,3
2017,INSTITUTO LUTERANO DE ENSINO SUPERIOR DE ITUMBIARA,ILES,Privada Sem Fins Lucrativos,GO,2.36307145927937,3
2017,CENTRO UNIVERSITÁRIO DA SERRA GAÚCHA,FSG,Privada Com Fins Lucrativos,RS,2.47028926141956,3
2017,INSTITUTO DE ENSINO SUPERIOR PLANALTO,IESPLAN,Privada Com Fins Lucrativos,DF,1.57251809744768,2
2017,FACULDADE BATISTA DO RIO DE JANEIRO,FABAT,Privada Sem Fins Lucrativos,RJ,2.15753780386288,3
2017,CENTRO UNIVERSITÁRIO INGÁ,,Privada Sem Fins Lucrativos,PR,3.07610889176741,4
2017,FACULDADE BERTIOGA,FABE,Privada Sem Fins Lucrativos,SP,2.39520007187988,3
2017,FACULDADE ORÍGENES LESSA,FACOL,Privada Sem Fins Lucrativos,SP,2.47000137707336,3
2017,Centro Universitário de Itapira,Ceunit,Privada Com Fins Lucrativos,SP,2.48383435648919,3
2017,ESCOLA SUPERIOR BATISTA DO AMAZONAS,ESBAM,Privada Com Fins Lucrativos,AM,2.13000356870991,3
2017,ESCOLA SUPERIOR DE TECNOLOGIA E EDUCAÇÃO DE RIO CLARO,ESRC,Privada Com Fins Lucrativos,SP,2.4039331848442,3
2017,FACULDADE DE ADMINISTRAÇÃO DE EMPRESAS,FACAMP,Privada Com Fins Lucrativos,SP,3.37667790389893,4
2017,FACULDADE DE CIÊNCIAS ECONÔMICAS,FACAMP,Privada Com Fins Lucrativos,SP,2.78520619143199,3
2017,INSTITUTO APHONSIANO DE ENSINO SUPERIOR,IAESUP,Privada Com Fins Lucrativos,GO,2.82998242304501,3
2017,FACULDADE DE TECNOLOGIA DO PIAUÍ,FATEPI,Privada Com Fins Lucrativos,PI,2.63250601574128,3
2017,FACULDADE DE DIREITO DE TANGARÁ DA SERRA,,Pessoa Jurídica De Direito Privado - Com Fins Lucrativos,MT,2.130890933,3
2017,FACULDADE NACIONAL,FINAC,Privada Com Fins Lucrativos,ES,1.80076524575,2
2017,FACULDADES INTEGRADAS EINSTEIN DE LIMEIRA,FIEL,Privada Sem Fins Lucrativos,SP,2.426475403798,3
2017,CENTRO UNIVERSITÁRIO DO INSTITUTO MAUÁ DE TECNOLOGIA,CEUN-IMT,Privada Sem Fins Lucrativos,SP,2.97051298346319,4
2017,CENTRO UNIVERSITÁRIO PLANALTO DO DISTRITO FEDERAL - UNIPLAN,UNIPLAN,Privada Com Fins Lucrativos,DF,2.31316650952295,3
2017,FACULDADE DE IBAITI,FEATI,Privada Sem Fins Lucrativos,PR,2.94918780828947,4
2017,CENTRO UNIVERSITÁRIO DO CERRADO-PATROCÍNIO,UNICERP,Privada Sem Fins Lucrativos,MG,2.64991036059316,3
2017,FACULDADE PITÁGORAS DO MARANHÃO,,Privada Com Fins Lucrativos,MA,2.54740800555009,3
2017,FACULDADE SALESIANA DO NORDESTE,FASNE,Privada Sem Fins Lucrativos,PE,2.71372513075359,3
2017,FACULDADE SANTÍSSIMO SACRAMENTO,FSSS,Privada Sem Fins Lucrativos,BA,2.39451127434678,3
2017,FACULDADE ANHANGUERA DE SERTÃOZINHO,FASERT,Privada Com Fins Lucrativos,SP,2.45748445903525,3
2017,Faculdade Estácio Euro- Panamericana de Humanidades e Tecnologias - Estácio EUROPAN,ESTÁCIO EUROPAN,Privada Com Fins Lucrativos,SP,2.44592490768123,3
2017,FACULDADE DE CIÊNCIAS HUMANAS E SOCIAIS,FUCAMP,Privada Sem Fins Lucrativos,MG,2.40163754383379,3
2017,FACULDADE DE TECNOLOGIA E CIÊNCIAS,FTC SALVADOR,Privada Com Fins Lucrativos,BA,2.88431419231623,3
2017,INSTITUTO PARAIBANO DE ENSINO RENOVADO,INPER,Privada Com Fins Lucrativos,PB,2.15290028762927,3
2017,FACULDADE ALFACASTELO,FCGB,Privada Sem Fins Lucrativos,SP,2.33641475381522,3
2017,FACULDADE DE RIBEIRÃO PRETO,AFARP,Privada Com Fins Lucrativos,SP,2.15928188370737,3
2017,FACULDADE CENECISTA DE VILA VELHA,FACEVV,Privada Sem Fins Lucrativos,ES,2.140331738,3
2017,FACULDADE ESAMC UBERLÂNDIA,ESAMC,Privada Com Fins Lucrativos,MG,2.13379175986308,3
2017,FACULDADE CESUSC,,Privada Com Fins Lucrativos,SC,3.07291773581156,4
2017,CENTRO UNIVERSITÁRIO LEONARDO DA VINCI,UNIASSELVI,Privada Com Fins Lucrativos,SC,2.70253343164026,3
2017,FACULDADE DE COMUNICAÇÃO E DESIGN  OSWALDO CRUZ,,Privada Com Fins Lucrativos,SP,2.40865845514286,3
2017,FACULDADE MICHELANGELO,MICHELANGELO,Privada Sem Fins Lucrativos,DF,1.69396663177394,2
2017,FACULDADE ANHANGUERA DE SÃO BERNARDO,,Privada Com Fins Lucrativos,SP,2.20284051085042,3
2017,FACULDADE IBMEC,IBMEC,Privada Com Fins Lucrativos,MG,3.39839333860899,4
2017,FACULDADE ESTÁCIO DE SÁ DE VITÓRIA,FESV,Privada Com Fins Lucrativos,ES,3.26557737483606,4
2017,CENTRO UNIVERSITÁRIO UNIDOM - BOSCO,UNIDOM - BOSCO,Privada Com Fins Lucrativos,PR,2.46933051229008,3
2017,FACULDADE PARAÍSO,FAP,Privada Com Fins Lucrativos,RJ,1.96597778313088,3
2017,CENTRO UNIVERSITÁRIO DE JAGUARIÚNA,FAJ,Privada Com Fins Lucrativos,SP,3.04805446146133,4
2017,CENTRO UNIVERSITÁRIO INTERNACIONAL,UNINTER,Privada Com Fins Lucrativos,PR,2.80296016376123,3
2017,FACULDADE PITÁGORAS DE UBERLÂNDIA,PIT UBERLÂNDIA,Privada Com Fins Lucrativos,MG,2.58297147469939,3
2017,CENTRO UNIVERSITÁRIO ALVES FARIA,ALFA,Privada Com Fins Lucrativos,GO,2.24614885507419,3
2017,CENTRO UNIVERSITÁRIO CATÓLICO DE VITÓRIA,,Privada Sem Fins Lucrativos,ES,3.19085536586558,4
2017,FACULDADE ESTÁCIO DE SÁ DE VILA VELHA,FESVV,Privada Com Fins Lucrativos,ES,3.03904466271683,4
2017,FACULDADE DE ADMINISTRAÇÃO DE SANTA CRUZ DO RIO PARDO,FASC,Privada Sem Fins Lucrativos,SP,1.93880577022305,2
2017,INSTITUTO DE ENSINO SUPERIOR E FORMAÇÃO AVANÇADA DE VITÓRIA,FAVI,Privada Com Fins Lucrativos,ES,2.30233724106086,3
2017,FACULDADE ANHANGUERA DE TABOÃO DA SERRA,FATS,Privada Com Fins Lucrativos,SP,2.06938074402597,3
2017,FACULDADE DE ENSINO SUPERIOR DE SÃO MIGUEL DO IGUAÇU,FAESI,Privada Com Fins Lucrativos,PR,2.27648761822337,3
2017,FACULDADE LATINO AMERICANA DE EDUCAÇÃO,FLATED,Privada Sem Fins Lucrativos,CE,2.22826066864234,3
2017,FACULDADE ANHANGUERA PITÁGORAS DE JUNDIAÍ,,Privada Com Fins Lucrativos,SP,2.14103983607094,3
2017,FACULDADE DOUTOR LEOCÁDIO JOSÉ CORREIA,FALEC,Privada Sem Fins Lucrativos,PR,2.34652722267171,3
2017,CENTRO UNIVERSITÁRIO MAURÍCIO DE NASSAU DE MACEIÓ,UNINASSAU MACEIÓ,Privada Sem Fins Lucrativos,AL,2.21314496915677,3
2017,Faculdade CNEC Itajaí,,Privada Sem Fins Lucrativos,SC,3.01404801280761,4
2017,FACULDADE PROJEÇÃO DE CEILÂNDIA,FAPRO,Privada Sem Fins Lucrativos,DF,3.01496338476683,4
2017,Centro Universitário Metropolitano de Maringá,UNIFAMMA,Privada Com Fins Lucrativos,PR,2.70786213103262,3
2017,Centro Universitário Estácio de Belo Horizonte - Estácio BH,ESTÁCIO BH,Privada Com Fins Lucrativos,MG,2.72664367529278,3
2017,CENTRO UNIVERSITÁRIO ESTÁCIO DE SANTA CATARINA - ESTÁCIO SANTA CATARINA,,Privada Com Fins Lucrativos,SC,2.6924082201096,3
2017,INSTITUTO DE CIÊNCIAS JURÍDICAS E SOCIAIS PROFESSOR CAMILLO FILHO,ICF,Privada Com Fins Lucrativos,PI,2.17340536336341,3
2017,FACULDADE VALE DO CRICARÉ,F.V.C.,Privada Sem Fins Lucrativos,ES,2.70551482641119,3
2017,FACULDADE DE EDUCAÇÃO DE PORTO VELHO,UNIRON,Privada Com Fins Lucrativos,RO,2.74175388639044,3
2017,FACULDADE DE VINHEDO,FV,Privada Sem Fins Lucrativos,SP,2.055381136,3
2017,FACULDADE ANHANGUERA DE TAGUATINGA,,Privada Com Fins Lucrativos,DF,2.22321818916854,3
2017,FACULDADE DE PATO BRANCO,FADEP,Privada Com Fins Lucrativos,PR,2.72444918757058,3
2017,FACULDADE FIA DE ADMINISTRAÇÃO E NEGÓCIOS,FFIA,Privada Sem Fins Lucrativos,SP,4.13126653471239,5
2017,FACULDADE ESTÁCIO DE BELÉM - ESTÁCIO BELÉM,ESTÁCIO BELÉM,Privada Com Fins Lucrativos,PA,2.67766754648167,3
2017,FACULDADE DE DIREITO FRANCISCO BELTRÃO,CESUL,Privada Com Fins Lucrativos,PR,3.353379164,4
2017,FACULDADES INTEGRADAS OLGA METTIG,FAMETTIG,Privada Com Fins Lucrativos,BA,2.569451818,3
2017,FACULDADE CENECISTA DE JOINVILLE - FACE,FCJ,Privada Sem Fins Lucrativos,SC,2.46505265021713,3
2017,FACULDADE DE SERTÃOZINHO,,Privada Sem Fins Lucrativos,SP,2.04041009011678,3
2017,Faculdade de Pinhais,FAPI,Privada Sem Fins Lucrativos,PR,2.08171343787393,3
2017,FACULDADE DE TELÊMACO BORBA,FATEB,Privada Com Fins Lucrativos,PR,2.24310526548961,3
2017,CENTRO UNIVERSITARIO PROJEÇÃO,UNIPROJEÇÃO,Privada Sem Fins Lucrativos,DF,3.2602354865164,4
2017,INSTITUTO DE ENSINO SUPERIOR DE RONDÔNIA,IESUR,Privada Sem Fins Lucrativos,RO,2.47841423880093,3
2017,FACULDADE FLAMINGO,,Privada Com Fins Lucrativos,SP,2.10362206750449,3
2017,CENTRO UNIVERSITÁRIO GERALDO DI BIASE,UGB,Privada Sem Fins Lucrativos,RJ,2.60330190655854,3
2017,FACULDADE DECISÃO,FADEC,Privada Com Fins Lucrativos,SC,2.165068525,3
2017,FACULDADE DE BOITUVA,FIB,Privada Sem Fins Lucrativos,SP,2.52466334268665,3
2017,FACULDADE DE EDUCAÇÃO SÃO FRANCISCO,FAESF,Privada Sem Fins Lucrativos,MA,2.41703462008674,3
2017,FACULDADE DE MEDICINA ESTÁCIO DE JUAZEIRO DO NORTE,ESTÁCIO FMJ,Privada Com Fins Lucrativos,CE,2.78404366545378,3
2017,FACULDADE UNINASSAU PARNAÍBA,,Privada Com Fins Lucrativos,PI,2.66945138797321,3
2017,FACULDADES INTEGRADAS DO VALE DO RIBEIRA,FIVR,Privada Com Fins Lucrativos,SP,2.56811173020729,3
2017,CENTRO UNIVERSITÁRIO SETE DE SETEMBRO,UNI7,Privada Com Fins Lucrativos,CE,3.00085439461773,4
2017,UNIVERSIDADE FUMEC,FUMEC,Privada Sem Fins Lucrativos,MG,2.74036767247308,3
2017,Faculdade Doctum de João Monlevade,DOCTUM,Pessoa Jurídica De Direito Privado - Sem Fins Lucrativos,MG,2.82202307992327,3
2017,CENTRO UNIVERSITÁRIO DO ESPÍRITO SANTO,UNESC,Privada Sem Fins Lucrativos,ES,2.88166370224155,3
2017,FACULDADE ESAMC SOROCABA,ESAMC,Privada Com Fins Lucrativos,SP,2.7372550760077,3
2017,FACULDADE DE ILHA SOLTEIRA,FAISA,Privada Sem Fins Lucrativos,SP,2.42488426258209,3
2017,CENTRO UNIVERSITÁRIO UNINOVAFAPI,UNINOVAFAPI,Privada Com Fins Lucrativos,PI,3.12984474838591,4
2017,FACULDADE SUL FLUMINENSE,FASF,Privada Com Fins Lucrativos,RJ,2.77551283465657,3
2017,FACULDADE UNIME DE CIÊNCIAS JURÍDICAS,FCJ,Privada Com Fins Lucrativos,BA,1.264365502,2
2017,FACULDADE VIZINHANÇA VALE DO IGUAÇU,VIZIVALI,Pessoa Jurídica De Direito Público - Municipal,PR,1.812372881,2
2017,FACULDADES DOCTUM DE CARATINGA,DOCTUM,Privada Sem Fins Lucrativos,MG,2.63251212907601,3
2017,FACULDADES INTEGRADAS DE ARARAQUARA,FIAR,Privada Sem Fins Lucrativos,SP,2.2566891541381,3
2017,FACULDADE UNIME DE CIÊNCIAS SOCIAIS,FCS,Privada Com Fins Lucrativos,BA,2.45122345285171,3
2017,FACULDADE DE CIÊNCIAS SOCIAIS APLICADAS,FACISA,Privada Com Fins Lucrativos,BA,2.90237348661582,3
2017,FACULDADE ALFREDO NASSER,FAN,Privada Sem Fins Lucrativos,GO,2.81856181741103,3
